query,title,description,link,content
personalized debt payoff plan best practices,Why Applying To All Eight Ivy League Schools Could Hurt Your Chances Of Admission,"Many students believe applying to all Ivy League schools will improve their chances after hearing about others accepted to all 8, but this approach doesn't mean success.",http://www.forbes.com/sites/christopherrim/2024/09/17/why-applying-to-all-eight-ivy-league-schools-could-hurt-your-chances-of-admission/,"Yale University

GETTY

In the spring of 2024, Bronx high school student Malena Galletto made headlines after being accepted to all eight Ivy League schools—in addition to the 20 other schools to which she had applied. Incredible stories of students like Malena defying the admissions odds circulate every spring, and while they certainly inspire students, they also mislead them.

Many students who read about the unbelievable successes of those accepted to all eight Ivies assume that they can improve their own odds by simply applying to all of the Ivy League schools. However, this is not the case, and devoting time and energy to completing eight Ivy League applications is actually a detrimental strategy for most students—here’s why:

1. Every Ivy League School is Distinct

While many students and parents regard “the Ivy League” as a homogenous bloc of elite schools, the league is made up of vastly different schools, each with its own character, offerings, and campus—and every Ivy League school is not a good fit for every student. When compiling their balanced college lists, students should think strategically about the types of programs, campuses, learning environments, and communities they want access to. Do you want to attend a small school with a low student-to-faculty ratio or a large school with a plethora of opportunities? Are you interested in conducting lab research or are you more focused on the classroom experience? Will you thrive in a city or a rural setting? A student’s college list should be reflective of their answers to these questions and thus tailored to their needs and goals—both personal and academic.

A student who approaches their college list in this way will almost certainly not craft a list that includes all eight Ivy Leagues. While Dartmouth students are minutes away from hiking and skiing opportunities in rural New Hampshire, Columbia undergraduates have New York City’s entertainment and internships at their immediate disposal. Harvard offers students a highly traditional and structured academic environment. Meanwhile, Brown is known for its Open Curriculum and its diverse, creative, and interdisciplinary approach to education—one that is best suited for students who gravitate toward multiple different disciplines or want to think outside the box. As a land-grant institution, Cornell attracts students who are community minded and who want to use their learning to benefit not only the college but also Ithaca’s tight-knit community, while UPenn is known for graduating students who have a global mindset and are prepared to enter the upper echelons of their professions. In other words, students should not regard Ivy League schools as synonymous with “elite education,” but should instead weigh their interest in each individual school based on its programs, culture, and unique offerings.

2. Applying to All Eight Schools Doesn’t Increase Your Odds of Admission

It’s a common misconception that applying to all eight Ivy League schools will improve your chances of acceptance to at least one. First and foremost, students should note that applying to eight schools, all with single-digit acceptance rates, does nothing to increase their odds at any single one of them. On the contrary, it actually detracts from a student’s overall odds of admission by overloading their college list with reach schools at the expense of matches and safeties. That is to say, students are hedging their bets at schools where they face overwhelming odds of rejection (even if they are highly qualified), rather than balancing their list with schools that they are more likely to earn acceptance to.

Additionally, each Ivy League school has its own specific admissions criteria—just as every Ivy League school is not a fit for every student, every student is not a fit for every Ivy League school. A standout Ivy League application is meticulously tailored to demonstrate a student’s unique qualifications for a specific institution. Students who apply to all eight schools often cut corners, overgeneralize their reasons for applying, or tailor their answers to what they assume “Ivy League admissions officers” want to hear—all of which can negatively impact their chances of acceptance. Those who truly wish to attend a given Ivy League school should focus dedicated energy on leveling up their application materials to the particular school that aligns with their authentic interests and goals and ensure that they are putting their best foot forward in their materials.

CEO: C-suite news, analysis, and advice for top decision makers right to your inbox.

Get the latest news on special offers, product updates and content suggestions from Forbes and its affiliates.
Sign Up

By signing up, you agree to our Terms of Service, and you acknowledge our Privacy Statement. Forbes is protected by reCAPTCHA, and the Google Privacy Policy and Terms of Service apply.
3. Hyper-Focusing on the Ivy League Can Distract You from Better Matches

If you are applying to all eight Ivy League schools simply because of their prestige, not only will you likely craft inauthentic and unimpressive applications, but you will also miss out on other great schools that may be a better fit for you. Remember that rankings and low admissions rates are not the only measures of a school’s rigor and excellence. Rather than devoting countless hours to writing supplemental essays for every Ivy League school, you should spend your time researching a diversity of schools that house strong programs in your intended area of study. If you are interested in STEM, for instance, you might find that CalTech or UT Austin’s innovative and forward-thinking programs are a better fit for you than Harvard’s traditional option.

Ultimately, students should not apply to all eight Ivy League institutions—or any school—just for the sake of applying or because of the prestige associated with earning an acceptance. At the same time, students can gain strategic insights from the inspiring students who were accepted to all eight Ivies. How did some of the students deciding between all of the Ivies make their choice? In 2014, Kwasi Enin chose Yale after visiting the campus and enjoying the school’s residential college system and friendly student body. Craig McFarland originally chose Yale, but changed his plans when the pandemic forced him to reprioritize having a support system nearby, leading him to choose Harvard. Ashley Adirika—a Florida teen who was accepted to all eight Ivies in 2022—made her decision based on the strength of Harvard’s academic offerings in her field of interest: “[W]hen I did further research for what I want to do specifically, which is explorations in policy and social policy and things of that nature, Harvard just had a better program.”"
personalized debt payoff plan best practices,Clear Government Plans Will Bring Business Backing For Climate Action,A new report underlines how ambitious national climate plans can drive accelerated private sector investment in the transition to a clean and nature-positive economy.,http://www.forbes.com/sites/mariamendiluce/2024/09/17/clear-government-plans-will-bring-business-backing-for-climate-action/,"An aerial view shows wind turbines at an onshore wind farm in Llandinam, central Wales, on January ... [+]

AFP VIA GETTY IMAGES

Record-breaking heatwaves, devastating wildfires, and catastrophic floods are becoming the norm rather than the exception as the world warms. 2023 was one of the warmest years on record according to the World Meteorological Organization and 2024 is likely to be even hotter.

The relentless burning of fossil fuels and the degradation of ecosystems are the root causes of this dangerous warming. To speed up the switch from coal, oil and gas to cleaner energies, and protect and restore nature, countries must submit ambitious and investible national climate plans which are called Nationally Determined Contributions (NDC) under the Paris Agreement.

NDCs are the cornerstone of global climate efforts. They represent each country's commitment to reduce greenhouse gas emissions and adapt to the impacts of climate. They should be renewed every five years, represent a progression beyond the previous plan, and reflect the highest possible ambition of each country. New NDCs for 2035 are due by next year.

A new report from the We Mean Business Coalition underlines how ambitious NDCs can drive accelerated private sector investment in the transition to a clean and nature-positive economy.

The report calls on countries and businesses to work together to propose their NDCs and plans, which should reduce emissions in line with science. More importantly they should offer enough clarity for companies to invest confidently. To this end, the plans should include targets to phase out unabated fossil fuels and replace with more renewable energy and energy efficiency, and halt and reverse deforestation.

The paper also emphasizes the importance of translating NDCs into concrete policy and actions and of increased government-business collaboration.

Adopting such an approach is essential because today private investment is woefully inadequate to keep the global temperature rise below 1.5°C as pledged under the Paris Agreement. The United Nations Environment Programme shows that the current NDCs would result in a 2.5C to 2.9C increase by the end of the century. Scientists are warning that higher levels of warming will be dangerous and very costly.

Forbes Daily: Join over 1 million Forbes Daily subscribers and get our best stories, exclusive reporting and essential analysis of the day’s news in your inbox every weekday.

Get the latest news on special offers, product updates and content suggestions from Forbes and its affiliates.
Sign Up

By signing up, you agree to our Terms of Service, and you acknowledge our Privacy Statement. Forbes is protected by reCAPTCHA, and the Google Privacy Policy and Terms of Service apply.

Current NDCs are not just falling short on ambition, but also on the details of how governments plan to drive investment in clean technologies and actively replace the fossil fuel system and infrastructure. Long-term certitude is fundamental to business. Companies need five-to-ten-year coherent government plans showing politicians are serious about accelerating the transition from fossil to clean to give them the confidence to scale investments in this direction.

And the reason business needs thought-through, coherent policy planning is because pollution and global warming has the ability to significantly disturb the operating environment for all businesses, whether large or small. From trade disruptions, damaging weather events and threats to resources and raw materials, to financial risks from rising insurance costs, volatile energy pricing, changing cost of land, labor and resources – there is much that good policy can prepare for.

The transition to a clean economy is also a massive opportunity. The shift to cleaner business models will offer a competitive advantage positioning companies at the forefront of technologies that are proving cheaper in the long run. Renewables, particularly solar and wind, are increasingly more cost-effective than fossil fuels. Reports from BloombergNEF show that solar and wind now represent 91% of new power capacity additions in 2023, indicating a significant cost advantage. The IEA estimates that around USD 2.8 trillion was invested in energy in 2023, of which more than USD 1.7 trillion went to clean energy. There is also growing evidence that companies that prioritize renewable energy are often viewed more favorably by consumers and investors.

A recent survey shows that investors believe clean energy investments will outperform most other sectors and earn investors money in the short and long term. They recognize that climate risks are significant business risks that, if ignored, could hurt the financial performance of companies and investment portfolios. They also believe that retail investors expect clean energy to outperform every sector except AI over the next 10 years.

Many businesses are already focused on accelerating change. More than 260 companies, collectively generating over $1.6 trillion in revenue, are working to phase out unabated fossil fuels under the Fossil to Clean campaign. And thousands of other companies are setting science-based targets, developing climate transition plans and investing in net-zero solutions.

Credible NDCs need to incorporate tangible ambition to accelerate clean energy and address deforestation, they must provide relevant plans, policies and incentives, and be able to work in lockstep with implementing departments and bodies. With these in place, countries can attract private capital and knowledge, and in doing so, create the ambition loop that can keep 1.5C in sight."
personalized debt payoff plan best practices,What Would Bobby Witt Jr Have To Do To Win AL MVP?,"While it will likely go down as one of the best runner-up seasons in MLB history, here is the argument for why Bobby Witt Jr could still in MVP.",http://www.forbes.com/sites/tylersmall/2024/09/17/what-would-bobby-witt-jr-have-to-do-to-win-al-mvp/,"KANSAS CITY, MISSOURI - MARCH 28: Bobby Witt Jr. #7 of the Kansas City Royals jogs onto the field ... [+]

GETTY IMAGES

Amid a 9-6 month, with a 2.5 game cushion in the Wild Card standing, the Kansas City Royals will need their MVP Bobby Witt Jr to finish the season as strong as his first five months were up to this point.

And for those five months, Witt has compiled one of the best seasons in Royals history.

With a league-leading .332 batting average, 200 hits, and 122 runs, the former 2nd overall pick enters Tuesday with a .984 OPS 9.0 bWAR, and 9.9fWAR as the team’s everyday shortstop. Witt has been amongst the league’s-best at the toughest infield position, with just 14 errors on 537 chances, and 17 outs above average.

According to Fangraphs WAR, Witt’s season is the best in Royals history, beating out the best of George Brett’s career and other franchise legends like Darrell Porter and John Mayberry.

ARLINGTON, TX - OCTOBER 4: Aaron Judge #99 of the New York Yankees smiles as he rounds the bases ... [+]

GETTY IMAGES

However, up to this point of the season, Witt’s breakout year will not end with the same hardware as Brett’s did in 1980, as the current odds still favor the Yankees captain by a large margin.

But, with about a dozen games remaining for both the Royals and Yankees, is there anything Witt can do to make the competition closer come the end of September?

Even though the Paw Patrol Curse has officially come to an end for Aaron Judge, hitting two home runs in the last 4-game set with Boston, number 99 is still amidst his worst stretch of the season since his slow start to the year, with a .239/.386/.388/.774 slash line in his last 19 games.

Forbes Daily: Join over 1 million Forbes Daily subscribers and get our best stories, exclusive reporting and essential analysis of the day’s news in your inbox every weekday.

Get the latest news on special offers, product updates and content suggestions from Forbes and its affiliates.
Sign Up

By signing up, you agree to our Terms of Service, and you acknowledge our Privacy Statement. Forbes is protected by reCAPTCHA, and the Google Privacy Policy and Terms of Service apply.

That being said, Judge does have the advantage on Witt in most statistical categories up to this point, and it is not particularly close.

Witt Jr. Judge

bWAR 9.0 9.7

fWAR 9.9 10.0

G 151 148

H 200 169

HR 32 53

RBI 108 132

SB 29 9

BA .332 .321

OBP .384 .455

SLG .600 .692

OPS .984 1.147

Even if they hit at the same rate as their previous 15-game stretches, Witt would only surpass Judge in batting average and tie him in fWAR. So the conversation would have to expand to more than just their season statistics.

The one argument for Witt would be his supporting cast. After losing Vinnie Pasuantino to the IL, Witt lost his main source of protection in the batting order, and was just the third member of the team with more than 17 homers on the season.

Alongside Salvador Perez, these three bats were the only members of the offense with an OPS+ over 105, as Michael Massey and Freddy Fermin are the only two players with an OPS above the league average.

While the Yankees offense has seemed to be a two-headed monster for a majority of the year, with Judge benefiting from Juan Soto’s first year in pinstripes, their offense as a whole has not been as complete either.

However, to have Austin Wells and Giancarlo Stanton both owning an OPS+ of 113, Gleyber Torres improving offensively to end the season, and the upside of Jasson Dominguez and Anthony Rizzo at the bottom of the order is a lot more challenging for an opposing pitcher to deal with than the young squad in Kansas City.

Witt’s defensive abilities at a premiere position would also give him a leg up over

KANSAS CITY, MISSOURI - JUNE 07: Bobby Witt Jr. #7 of the Kansas City Royals dives into third for ... [+]

GETTY IMAGES

Judge, despite Judge also playing one of the three toughest positions in baseball for over two-thirds of his games played (98 games in CF).

While Judge does not rank as high in the advanced metrics as Witt does amongst shortstops, Judge has made a concerted effort to only make the appropriate plays when playing centerfield. With a 1.000 fielding percentage and 4 assists in 844 innings, the 6’7, 282 lb outfielder is not trying to run through any more fences.

The last consideration a voter may have in Witt’s favor would be regarding the jump the Royals made as a team behind Witt’s career year.

After a 56-106 record in 2023, which was worse than their 97-loss 2022 season, an 80-win season was seen as far-fetched heading into the 2024 campaign. Now, with a 94.6% chance to reach the playoffs, Witt deserves the benefit of his play leading a newcomer into October.

However, even if Witt does join the likes of players like Mike Trout and Alex Rodriguez and recent players to post 10+ WAR seasons and not win the MVP, it’s safe to say Witt would take one less trophy on his mantle for his first real chance at a ring."
budgeting for extra debt payments strategies,Most Important Letter This Year? Your Part D Annual Notice Of Changes,This year's Medicare Open Enrollment is set to be one of the most important ones ever. It starts with your Part D Annual Notice of Changes.,http://www.forbes.com/sites/dianeomdahl/2024/09/17/most-important-letter-this-year-your-part-d-annual-notice-of-changes/,"Be on the lookout for one of the most important letters you'll get this year.

GETTY

You probably find lots of junk mail in your mailbox. But, if you are one of the 50 million beneficiaries with Part D prescription drug coverage, either through a stand-alone Part D drug plan or incorporated into a Medicare Advantage plan, pay attention now. Buried in that stack of mail will be the Annual Notice of Changes (ANOC), a letter about Open Enrollment and your Part D drug coverage for next year.

The Open Enrollment Period, October 15-December 7, is your chance to ensure you have the best plan in 2025 and the ANOC is your guide to the changes. A KFF analysis showed that only 3 in 10 beneficiaries (29%) compared their current plan with others during Open Enrollment. If I had the space, I could share dozens of tales of woe from those who got caught asleep at the wheel and woke up on January 2 to unpleasant cost and coverage issues.

This may be the most important Open Enrollment you have experienced. Why do I believe that? Six words – the $2,000 cap on drug costs. According to a White House fact sheet, this cap will save nearly 19 million Part D enrollees at least $400 next year. However, it will create cost and coverage challenges for many. Part D drug plans will pick up most of these costs so they likely will implement measures to reduce the hit. The elimination of the 5% Catastrophic Coverage coinsurance is one small step toward the $2,000 cap that is expected to save 1.5 million drug plan enrollees about $3,100. 65 Incorporated reviewed 2024 drug plans to identify the impact.

59 of 65 plans increased their monthly premiums, anywhere from 2% to 84%.
Almost a third of drug plans changed a copayment to a coinsurance. One example, instead of $47, the cost sharing is 25%, increasing the out-of-pocket cost.
And 30% of plans increased the coinsurance for Tier 4 and Tier 5 drugs. Even a change of 1-2% can increase costs by several hundred dollars a month.

We can expect to see more of the same with 2025 plans.




Here’s What To Do with the Annual Notice

Insurers sponsoring Part D coverage must send an ANOC to all plan members by September 30. The notice can be 15-30 pages or more, depending on your plan. The Centers for Medicare and Medicaid Services has a template that identifies some important pages. Check these out.

Investing Digest: Know what's moving the financial markets and what smart money is buying with Forbes Investing Digest.

Get the latest news on special offers, product updates and content suggestions from Forbes and its affiliates.
Sign Up

By signing up, you agree to our Terms of Service, and you acknowledge our Privacy Statement. Forbes is protected by reCAPTCHA, and the Google Privacy Policy and Terms of Service apply.

Page 4: A summary of important costs for 2025.

This summarizes the changes in premium and drug tier cost sharing. You’ll discover whether your premium is increasing and/or the tier costs for your drugs will change, especially a copayment changing to a coinsurance.

Page 6: Section 1, unless you choose another plan …

The plan you have this year may not be around next year. If that happens, you will be enrolled automatically in another plan. When this has happened in the past, plans tended to assign enrollees to the one with the highest premium.

Page 7: Section 2.2, changes to the pharmacy network.

The plan will alert you if changes have been made but you will have to research which pharmacies are in or out.

Page 8: Section 2.3, changes to Part D prescription drug coverage.

This is one of the most important sections in the ANOC. The plan must provide a copy of the drug list (unlikely) or electronically (a link). If there have been no changes to covered drugs, tier assignments, or restrictions (prior authorization, step therapy), you can breathe a sigh of relief. However, in the current environment, it’s more likely that there will be changes. The ANOC emphasizes, “Review the Drug List to make sure your drugs will be covered next year and to see if there will be any restrictions, or if your drug has been moved to a different cost-sharing tier.”

Pages 11-16: Changes to your cost-sharing in the drug payment stages.

You’ll find out the plan’s deductible and standard and preferred cost-sharing in each payment stage.




Next Steps

The ANOC will identify the changes in your plan but then, it’s up to you. You’ll need the Medicare Plan Finder to determine the impact of changes. 2025 plan information will start appearing in early October. CMS has a video, “2023 How to use Medicare Plan Finder, step-by-step,” that provides a good introduction to using this tool.

Here are a few questions you should answer.

Are all your medications covered?
How much will you pay for drugs?
Did your pharmacy network change?
Are there new restrictions on your medications?
Is your premium increasing?

After completing this research, if your current plan will be the best for you in 2025, do nothing. The plan will renew automatically. However, if another plan will be better, enroll in it. The deadline is December 7 but don’t wait until the last minute. Things can get crazy.

With all the changes, there is little doubt that the 2024 Open Enrollment Period will be very important. The Annual Notice of Changes is your guide to identifying the best drug coverage in 2025 and the Medicare Plan Finder is the tool. Don’t blow this opportunity."
