query,title,description,link,content
Snowball debt payoff method effectiveness,3 Ways Bitcoin Could Impact The U.S. Economy,"What if bitcoin could address national debt, diversify reserves, and stimulate the U.S. industry? New data offers a macro perspective.",http://www.forbes.com/sites/mariepoteriaieva/2024/09/17/3-ways-bitcoin-could-impact-the-us-economy/,"Illustrative image of two commemorative bitcoins seen in front of the national flag of the United ... [+]

NURPHOTO VIA GETTY IMAGES

The narrative around bitcoin, once dominated by speculation and controversy, is gradually evolving. There is a growing interest in exploring its potential to positively impact the U.S. economy, championed by several pro-crypto politicians. Most recently, this perspective has also been actively promoted by the Republican presidential nominee Donald Trump, prompting broader public debate.

This momentum offers a good opportunity to assess whether this idea holds real economic merit. A closer examination reveals that bitcoin holds potential to reduce the U.S. national debt, diversify the country’s reserves, and help its oil industry.

Bitcoin Bitcoin +3.8% Could Help Reduce National Debt

Speaking at the Bitcoin 2024 conference in Nashville, Republican Senator Cynthia Lummis introduced an ambitious proposal to establish a strategic bitcoin reserve. Her bill, which she described as “our Louisiana Purchase moment,” outlines a plan to acquire 1 million BTC over five years. The senator also claimed that such a reserve would “serve as an additional store of value to bolster America’s balance sheet.”

The U.S. balance sheet is indeed in dire need of bolstering. With the national debt now towering at $35 trillion, the country is spending $0.95 trillion annually just to service it. Compounding the problem is the declining dominance of the dollar, which exacerbates the situation by reducing demand for Treasury securities – leaving the government with fewer resources to borrow and refinance the debt.

The recent European Central Bank report highlights this trend. While the euro’s share of global foreign exchange reserves has remained steady at around 20% over the past two decades, the US dollar’s share has dropped from over 70% to below 59%. Meanwhile, the share of “other currencies” has surged from 9% to almost 22%.

Rising debt and shrinking borrowing capacity form a troubling trend, and one of these trajectories must be reversed. Reducing debt seems like the more feasible option, as the dollar’s decline is driven by factors beyond economics, notably the U.S. weaponizing the dollar, which has prompted many countries to reduce their over-reliance on it.

Reducing national debt traditionally involves unpopular political decisions, such as raising taxes and cutting social spending, making it seem particularly difficult in the current political climate. So, desperate times call for desperate – or creative – measures, and bitcoin might just be the answer.

Bitcoin appeals to people for the same reasons the dollar does not: free from the influence of any single nation's politics, it is provably scarce and enables borderless and relatively cheap transactions (especially with its layer-2 Lightning Network). Furthermore, with a market cap of just $1 trillion, bitcoin price has room for growth – a potential that could be realized rather quickly if the world’s largest economic power were to embrace it. By creating a strategic BTC reserve, the U.S. could trigger a bandwagon effect, potentially driving up the coin’s price and enabling the Treasury to pay down part of the national debt through capital gains.

The Impact Of A Bitcoin National Reserve

Diversification is key to financial resilience, whether in personal portfolios or national reserves. From this perspective, bitcoin stands out as a unique asset class that operates independently of traditional financial systems.

As shown by The Block, bitcoin’s correlation with stock indexes and gold fluctuates between 0.9 (highly correlated) and -0.9 (negatively correlated). This variability underscores its diversification potential, which the U.S. foreign reserves could strategically leverage.

Indeed, the U.S. foreign reserves are rather unvaried and modest given the scale of the American economy. Composed primarily of gold, special drawing rights with the IMF, and foreign currencies like the euro and yen, the U.S. official reserve assets now stand at only $246 billion ($908 billion if gold were recalculated at the current market price).

Enter bitcoin. By diversifying the foreign reserves, the leading cryptocurrency could help better manage external economic shocks that might threaten the dollar's stability, such as fluctuations in other reserve assets. A stronger, more diversified reserve would also enhance confidence in the dollar.

Additionally, a more robust foreign reserve would be invaluable in times of crisis. Black swan events often come without warning, and it’s generally wiser to put your eggs in different baskets to ensure you have some for tomorrow.

Sustainable Bitcoin Mining To Boost Oil Industry

The U.S. is probably the country where embracing bitcoin at a national level could produce the most significant catalytic impact. After China’s mining ban in 2021, America became a major hub for bitcoin mining, producing almost 38% of the total hashrate, according to the latest available data from CBECI (2022). Additionally, 13 out of the world’s 24 largest mining companies are registered in the U.S., as per CompaniesMarketCap.

Bitcoin mining involves using specialized rigs to secure the blockchain with large amounts of electricity in exchange for newly created BTC and transaction fees. Since miners are location-agnostic, they can be set up virtually anywhere with abundant and inexpensive energy. This flexibility drives innovation, and one of the most promising avenues for bitcoin mining in the U.S. today is capturing flared gas, a by-product of oil extraction. American oil producers like ExxonMobile and ConocoPhillips are already partnering with bitcoin mining companies that install their rigs in North Dakota oil fields. The higher bitcoin’s price climbs, the more profitable such operations become, while also reducing harmful emissions, boosting economic activity, and creating an additional wealth source for the country.

The Risks Of Adopting Bitcoin

For a seasoned bitcoiner who has maintained confidence in the asset through market’s ups and downs, the economic benefits of bitcoin may seem obvious. However, most people would question whether is it wise – or safe – for a country to gamble with its reserves?

These concerns are not without merit, and it’s crucial to map the risks before taking any important decision. Indeed, for the above scenario to hold, bitcoin must fulfill its initial promises. The blockchain must function as intended and real adoption must grow to ensure that U.S. market intervention does not simply inflate the coin’s price. Furthermore, the officials must consider issues like volatility, liquidity, and security very seriously.

While the risks are real, the potential rewards of adopting bitcoin on a national level could be transformative for the economy. Some countries, like El Salvador or Bhutan, have already recognized this.

Bitcoin In El Salvador And Bhutan

El Salvador is famous for becoming the first country to adopt bitcoin as legal tender, integrating it into several national projects aimed at stimulating economic growth and reducing debt. However, shortly after the introduction of the Bitcoin Law, the IMF warned the country of the risks on “financial stability, financial integrity, and consumer protection”, urging it to remove the legal tender status. El Salvador refused.

Three years in, El Salvador holds 5,875 BTC, now worth 34.5% more than the average purchase price. The country has also begun mining Bitcoin using geothermal energy from its volcanoes and has seen its bonds outperform the Invesco Emerging Markets Sovereign Debt ETF (PCYInvesco Emerging Markets Sovereign Debt ETF 0.0%) in 2023, benefiting from the momentum around Bitcoin spot ETFs. Even the IMF now cannot help but concede that “on bitcoin, many of the risks have not yet materialized”.

Overall, despite the grassroot bitcoin adoption remaining low at 12%, President Nayib Bukele views the project as a success. “It gave us branding, it brought us investments, it brought us tourism,” he said in a recent interview for Time Magazine.

With far less fanfare, the Asian nation of Bhutan has been quietly mining bitcoin since 2019. Arkham Intelligence’s recent research reveals that the country now holds 13,036 BTC - an impressive amount equivalent to over a quarter of its GDP. For one of the world's most isolated countries, bitcoin could be the way to bolster its financial independence, while its abundant hydroelectric resources provide a sustainable way to do so.

The U.S. has different economic goals from El Salvador or Bhutan, but investing in bitcoin aligns with them too. Moreover, given its immense economic power, even a relatively small investment could have an outsized return. While Bhutan holds 27% of its GDP in bitcoin and El Salvador 1%, Senator Warren’s proposed purchase of 1 million BTC would represent just 0.2% of the U.S. GDP (at current prices). Yet, such a move by the world's largest economy could potentially send bitcoin’s price “to the moon” and help address some of the country's serious economic challenges."
Snowball debt payoff method effectiveness,Employers Are Tackling Gen Z’s Student Loan Debt,Employee benefits have existed almost as long as companies have had employees.,http://www.forbes.com/sites/jefffromm/2024/09/17/gen-z-student-loan-debt-is-being-tackled-by-employers/,"Employee benefits have existed almost as long as companies have had employees. Caesar Augustus apparently gave his retiring soldiers pensions in 13 BCE to stave off rebellions. Caesar didn’t have to worry about Glassdoor reviews or rants on social media, but he was forward leaning.

In today’s Gen Z-driven workplace, curated choices and values matter. Compensation is king, but benefits can still be a crucial differentiator.

Gen Z is redefining collaboration.

COURTESY PEXELS

“In today’s world of work, competitive pay is table stakes — it’s the bare minimum,” says Johnny C. Taylor, Jr., the president and CEO of SHRM, the Society for Human Resource Management. “Employees expect more, with holistic benefits packages becoming an increasingly critical part of what sets organizations apart in the fight to attract and retain talent.”

Taylor noted: “According to SHRM’s 2024 Employee Benefits Survey, health care, leave, and retirement savings and planning rank the highest in employer importance regarding benefits. But right below those three is a second tier of high-priority benefits: flexible work, family care, and professional and career development, which points toward employers’ desire to meet employee wants and needs in a tight labor market where many workers continue to value flexibility and professional development.”

Your Benefits — and Employee Perception — Are Part of Your Brand

Just as brands invest in consumer-facing brand-building, they realize they must also have strong employment/retention brands. Whether competing for the best talent or giving high-performers more reasons to build careers, they are starting to look more closely at how they are perceived as employers — especially as the workforce becomes more diverse.

Among the perks that employers believed would incentive team members to be loyal and stick around include:

● Vacation

CEO: C-suite news, analysis, and advice for top decision makers right to your inbox.

Get the latest news on special offers, product updates and content suggestions from Forbes and its affiliates.
Sign Up

By signing up, you agree to our Terms of Service, and you acknowledge our Privacy Statement. Forbes is protected by reCAPTCHA, and the Google Privacy Policy and Terms of Service apply.

● Health insurance

● Life insurance

● Parental leave policies

● Rewards for anniversaries

● Discounts on goods and services

● Matching grants for charitable donations

● Counseling resources

● Commuter benefits

● Travel perks

● Retirement plans

● And, most recently, remote work options and liberal PTO (personal time off)

Let’s not forget on-site activities, free snacks, a wide range of perks and celebrations, and off-site trips designed to boost company culture.

But What About Education?

Student loan debt has surpassed credit card debt and is now a whopping $1.75T. Who can even start thinking about what they’ll do when they’re 65 when those monthly payments loom?

Although all generations may be interested in “getting smarter” on their employer’s dime (or millions of dimes), younger team members are understandably more interested in digging themselves out of short-term debt than worrying about buying that home — like they might have been thirty years ago. Savvy companies must continue to research to understand what’s of the most significant value to the people they want to hire and retain.

How Do Companies Know What Their Employees Want?

Forrester Principal Analyst Betsy Summers says, “According to recent data from a joint survey to HR leaders from Forrester and HR Executive, an annual survey is the most commonly relied-on research method for understanding retention and engagement drivers.

Still, only 60% of organizations report doing surveys. More in-depth research, like journey mapping, monthly pulse surveys, and sentiment analysis, sits at 25% and 16%, respectively. Though every company might say they want to understand what attracts and retains their workforce, only those who invest in the right listening strategies and then act on the results are serious about it.”

Strong understanding of workforce needs led to introducing student loan-related benefits at the University of Miami, UHealth and the Miller School of Medicine. “Our approach is driven by a deep commitment to listening to our faculty and staff to offer benefits that can make a difference in their lives”, says Alison Mincey, their SVP and CHRO. “Recognizing the impact of student loan debt on our workforce, we established a student loan repayment assistance program that provides monthly contributions to repay student loans, resources to achieve loan forgiveness, and loan coaches for additional support. Thousands are already benefiting from this program.”

In addition, AI and other workplace transformations mean that employees need to continuously “upskill” or “reskill” to progress at their current company or move on to something bigger and better, increasing the cost of education.

“Student loan debt-related benefits have been solving critical staffing and turnover issues for employers in healthcare and education for a long time,” says Scott Thompson, CEO of Tuition.io. Scott continued, “We’re now seeing this strategy emerge in other industries looking to appeal to the next generation of workers, as Healthcare and 401(k) benefits just aren’t as relevant for younger, healthier employees with high living expenses.” While most employers are still on the sidelines some forward-looking and responsive companies stand out as setting the next standard of benefits for the future workforce.

Verizon is one of those companies. Earlier this year Verizon implemented its Secure Your Future program. Starting on day one of employment, employees can get up to a 6% company matching 401(k) contribution by making qualified student loan payments. “When the Secure 2.0 Act was passed, we saw it as an opportunity to offer another way for our employees to earn a matching contribution to our retirement plan,” stated Kevin Cammarata, Vice President of Benefits at Verizon. He continued, “We aimed to bridge the gap between employees’ immediate financial needs and long-term goals, which can be a differentiator with those that are wrestling with student loan debt.” Verizon reports over 1,800 employees have enrolled in the benefit since the program launched.

Technology also now plays a more significant role in benefits selection and administration for digitally savvy employers and employees. Self-service benefits management has become necessary for forward thinking companies, especially those trying to attract employees of all ages and stages.

Thompson summarized “Gen Z has been hit hardest by student loan debt, and employers must find solutions that ease the pain. By supporting individual financial wellness and career growth, companies can both stand out to this population and solve the damaging impact of turnover on organizational performance.”"
Snowball debt payoff method effectiveness,Improving Your Startup's Efficiency: Tips For Implementing New Tech,"While innovative ideas and a passionate team are essential, the strategic use of technology can significantly boost a startup's effectiveness and optimization.",http://www.forbes.com/councils/forbesbusinesscouncil/2024/09/17/improving-your-startups-efficiency-tips-for-implementing-new-tech/,"Raul Handa | Founder & CEO of The Forttuna Group | Visionary Leader & Serial Entrepreneur.

GETTY

The ability to operate efficiently and adapt quickly to changing market conditions can make the difference between a startup's success and failure. While innovative ideas and a passionate team are essential, the strategic use of technology can significantly boost a startup's effectiveness and optimization.

When I founded my startup, I used a range of technological tools to streamline operations and enhance productivity. For instance, adopting cloud computing services allowed us to scale our infrastructure seamlessly as our needs grew, and project management tools kept our team aligned and focused. These tools were instrumental in navigating the early challenges of running a business with limited resources and tight deadlines.

Based on this experience, here's a guide to some of the types of technology startups can consider to help streamline operations, support productivity, drive growth, enhance the customer experience and manage costs.

1. Streamlining Operations

Operational efficiency is crucial for startups, which often operate with limited resources and tight budgets. As such, founders can explore technologies that help streamline workflows and reduce unnecessary costs. For instance:

Cloud computing: Cloud services can help startups scale their infrastructure based on demand. This flexibility eliminates the need for costly physical servers and provides easy access to data and applications from anywhere.

Project management tools: Startups might also find it helpful to adopt tools that help teams manage projects more effectively. Using a platform for task tracking, communication and resource allocation can enhance transparency and ensure employees are aligned and focused on their tasks.

Customer relationship management systems: CRM systems help startups manage their interactions with customers more efficiently by tracking customer interactions and providing valuable insights into customer behavior.

2. Supporting Productivity

Implementing technology that automates repetitive tasks and facilitates better time management can lead to significant gains in efficiency. Examples include:

Automation tools: Automation can reduce the time spent on routine activities and allow team members to focus on more strategic initiatives. When starting my business, automating our email marketing campaigns and invoicing processes was particularly helpful. This automation saved valuable time and reduced manual errors.

Collaboration software: A number of platforms provide communication and collaboration features that help remote and in-office teams work together. Tools that support real-time messaging, video conferencing and file sharing can make it easier to coordinate efforts and complete projects on time.

Time management apps: Time-tracking software helps teams track their time and identify areas where efficiency can be improved. This can enable better workload management and set realistic deadlines.

3. Driving Growth

For startups, growth is not just an objective; it's a necessity. Attracting more customers, increasing revenue and expanding market presence are essential for long-term success. Some tools that may help with this include:

Digital marketing tools: Marketing platforms that offer advanced targeting options and analytics can help businesses reach their target audiences more effectively.

E-commerce solutions: Startups in the e-commerce space can explore platforms that handle payment processing, inventory management and order tracking, so the business can focus on growing their customer base and increasing sales.

Data analytics: By analyzing customer behavior, market trends and business performance, startups can identify growth opportunities and optimize their strategies accordingly.

4. Enhancing The Customer Experience

A positive customer experience is vital for building loyalty and gaining a competitive edge. Some technology can enhance how startups interact with and serve their customers. For example:

Chatbots: AI-powered chatbots can provide support to customers by answering queries and resolving issues in real time. Consider integrating chatbots into websites and apps to ensure customers receive service around the clock.

Personalization tools: Technology can also be used to analyze customer data and recommend relevant products, content and offers. This can enhance the overall customer experience and increase the likelihood of repeat business.

Customer feedback systems: Research platforms that can help gather feedback from customers. Understanding customer needs and preferences can help startups make informed decisions about product development and service improvements.

5. Managing Costs

Cost management is vital for startups, which often have limited budgets. Technology can help reduce expenses in various ways.

Virtual offices: Flexible office solutions that eliminate the need for long-term leases can help startups access professional office spaces and amenities as needed, reducing overhead costs.

Freelance platforms: These platforms enable startups to hire skilled professionals on a project basis. When we first started, we found hiring freelancers for tasks such as graphic design and content creation was especially beneficial. This approach allowed us to access high-quality work while managing our budget effectively.

Open-source software: Open-source software can offer functionality without the hefty price tags of proprietary software, though there are risks startups should consider before adopting these solutions.

Best Practices When Adopting New Technology

When adopting new technology, it’s essential for founders to follow best practices to ensure successful integration and maximize benefits. One key strategy is to thoroughly evaluate each tool to ensure it aligns with your startup's specific needs and goals. It's also important to avoid overwhelming your team by implementing too many new tools at once. Instead, introduce them gradually, and ensure each one addresses a distinct need.

Training is crucial as well. Provide comprehensive onboarding and support to help your team adapt to new systems effectively.

Lastly, continuously review and assess the effectiveness of the tools you've implemented to ensure they continue to meet your evolving needs. I've found it helpful to ask the following questions:

1. Is this tool still aligned with our current business objectives?

2. How frequently is the team using this tool, and are they using it as intended?

3. What measurable impact has this tool had on our productivity or efficiency?

4. Are there any new alternatives on the market that might better suit our evolving needs?

If a tool is no longer effective, gather feedback from your team about why the tool isn't meeting their needs. Then, research alternative solutions that address the identified shortcomings, plan a phased transition to minimize disruption if switching to a new tool, and provide training and support for any new solution implemented.

This continuous evaluation process can help your startup maintain an efficient and effective tech stack that evolves with your business's needs. Ultimately, when you take a strategic approach to implementing new technology, you can enhance the effectiveness of your startup.

Forbes Business Council is the foremost growth and networking organization for business owners and leaders. Do I qualify?"
