query,title,description,link,content
budgeting for extra debt payments strategies,Does Partial Automation Stop Distracted Driving?,"Drivers are more likely to multitask and not pay close attention when using partial automation systems, doing things like eating, grooming and using electronics.",http://www.forbes.com/sites/tanyamohn/2024/09/17/does-partial-automation-stop-distracted-driving/,"Two new studies examined how drivers interact with and use partially automated driving systems. 

INSURANCE INSTITUTE FOR HIGHWAY SAFETY

Drivers are more likely to multitask and not pay close attention when using partial automation systems, doing things like eating, grooming ,using electronics, and some even engage in this kind of risky behavior even while “following” the rules for attention requirements, quickly learning to skirt set limits.

Those are the highlights of new research based on two studies that examined how drivers interact with and use partially automated driving systems, released on Tuesday by the Insurance Institute for Highway Safety, a nonprofit financed by the insurance industry. Both month-long studies were conducted with the Massachusetts Institute of Technology’s AgeLab.

Partial automation systems use cameras and other sensors that can keep cars moving down the road in the center of the lane at a selected speed, slowing down to avoid other vehicles and accelerating when the way is clear, researchers said, but drivers are supposed to pay close attention to what’s happening on the road and be ready to take over at any time.

But the studies found that not all drivers do.

“These results are a good reminder of the way people learn,” David Harkey, the Insurance Institute’s president, said in a statement. “If you train them to think that paying attention means nudging the steering wheel every few seconds, then that’s exactly what they’ll do.”

“In both these studies, drivers adapted their behavior to engage in distracting activities,” Harkey added, noting that the research underscores the importance of “why partial automation systems need more robust safeguards,” like driver monitoring systems, to prevent misuse and ensure that drivers pay attention to the technology and the road.

In the first study, “Rinse and repeat: behavior change associated with using partial automation among three samples of drivers during a 4-week field trial,”drivers were much more likely to check their phones, eat a sandwich or do other visual-manual activities while using Volvo’s Pilot Assist partial automation system than when driving unassisted.

Passport: Explore the finest destinations and experiences around the world in the Forbes Passport newsletter.

Get the latest news on special offers, product updates and content suggestions from Forbes and its affiliates.
Sign Up

By signing up, you agree to our Terms of Service, and you acknowledge our Privacy Statement. Forbes is protected by reCAPTCHA, and the Google Privacy Policy and Terms of Service apply.

In the analysis of driver behavior, researchers examined how likely drivers were to engage in non driving activities when using the automation compared to when they were not and then evaluated how this relationship changed over time.

Overall, they found that the tendency to multitask increased over time for some drivers as they grew more comfortable – drivers became bolder and more complacent as they got used to the technology. Other drivers were more distracted while using the system from the start.

The study monitored driving at various stages of software updates that improved the lane-centering feature and attention reminders, but all versions required the driver to keep their hands on the steering wheel.

Regardless of the version of the system used, drivers engaged in distracting visual-manual activities, including eating, grooming and using electronics, more often when using Pilot Assist than while driving without it, whether they used the feature a lot or hardly at all.

“The takeaway for me was that the technology was linked to more distraction,” Ian Reagan, senior research scientist at the Insurance Institute and the study’s lead researcher, said in a statement.

A second study, “Finding windows of opportunity: how drivers adapt to partial automation safeguards over time,” examined how the driving behavior of people who had never used Tesla’s Autopilot or any other partial automation system changed over a month-long period.

The study focused on how often the drivers triggered the system’s initial attention reminders, escalated warnings and emergency slowdown and lockout procedures. It found that many drivers using Tesla’s Autopilot system quickly mastered the timing interval of its attention reminder feature so that they could prevent warnings from escalating to more serious interventions.

Drivers did nondriving secondary activities, looked away from the road, and had both hands off the wheel more often during the alerts and in the 10 seconds before and after them as they learned how the attention reminders worked, researchers said, and the longer drivers used the system, the less time it took them to take their hands off the wheel again once the alerts stopped.

“These results show that escalating, multimodal attention reminders are very effective in getting drivers to change their behavior,” Alexandra Mueller, senior research scientist at the Insurance Institute and the second study’s lead author, said in a statement. “However, better safeguards are needed to ensure that the behavior change actually translates to more attentive driving.”

Earlier this year, the Insurance Institute launched a new ratings program to encourage automakers to incorporate more robust safeguards into their partial driving automation systems.

For more information about the studies, click here."
budgeting for extra debt payments strategies,Diddy’s Sex Trafficking And Racketeering Defense Faces Major Challenge,"Hip-hop mogul Sean ""Diddy"" Combs has been indicted on charges of sex trafficking, racketeering and prostitution.",http://www.forbes.com/sites/sughnenyongo/2024/09/17/diddys-sex-trafficking-and-racketeering-defense-faces-major-challenge/,"Sean ""Diddy"" Combs attends Black Tie Affair For Quality Control's CEO Pierre ""Pee"" Thomas at Fox ... [+]

GETTY IMAGES

Hip-hop mogul Sean “Diddy” Combs has been hit with serious charges, including sex trafficking, racketeering, and prostitution. Authorities arrested the music icon after a sealed indictment was filed by the U.S. District Court for the Southern District of New York (SDNY). In response, Combs’ legal team is pushing for his release on a staggering $50 million bail package, secured by two of his Miami properties—one of which is appraised at $48 million, according to court filings.

Prosecutors are pushing back and asking that Combs remain behind bars until his trial, labeling him “dangerous”and a “flight risk” in the wake of his arrest.

The indictment against Combs alleges that he was responsible for several criminal enterprises involving sex trafficking, forced labor and prostitution. Combs’ arrest, which occurred a day before the 14-page indictment was unsealed on Tuesday morning, sent shockwaves through the entertainment industry and social media. Federal prosecutors in the Southern District of New York allege in detail that for years, Combs used his power and influence to fly under the radar and take advantage of women by committing serious violations of federal law. The charges, which include racketeering—a crime often associated with organized crime syndicates—paint a picture of a long-running and intricate operation. Sex trafficking is the coercion, fraud, or force used to compel people into commercial sex acts, while racketeering under the RICO Act allows prosecutors to go after individuals involved in ongoing criminal enterprises.

Sean ""Diddy"" Combs attends Homecoming – Yardfest at Howard University in Washington, DC. (Photo by ... [+]

GETTY IMAGES FOR SEAN ""DIDDY"" COMBS

Since the news broke, Combs’ attorneys have been making attempts to clear the client’s name and in a released statement, Combs’ legal team, led by attorney Marc Agnifilo, is fighting hard to show their client’s innocence.

“We are disappointed with the decision to pursue what we believe is an unjust prosecution of Mr. Combs by the U.S. Attorney’s Office,” Agnifilo said. “Combs is a music icon, self-made entrepreneur, loving family man, and proven philanthropist who has spent the last 30 years building an empire, adoring his children, and working to uplift the Black community. He is an imperfect person but he is not a criminal.”

Agnifilo and his team may face an uphill battle due to the SDNY’s conviction rate.

The SDNY is one of the most prominent federal courts in the United States and is known for handling high-profile cases, including financial crimes, terrorism and organized crime and the conviction rate in federal courts, including the SDNY, is also high with federal prosecutors boasting a conviction rate of approximately 90% to 95%. According to the United States Sentencing Commission, the SDNY specifically has a high conviction rate, with over 95% of all criminal cases resulting in a guilty plea.

CEO: C-suite news, analysis, and advice for top decision makers right to your inbox.

Get the latest news on special offers, product updates and content suggestions from Forbes and its affiliates.
Sign Up

By signing up, you agree to our Terms of Service, and you acknowledge our Privacy Statement. Forbes is protected by reCAPTCHA, and the Google Privacy Policy and Terms of Service apply.

In 2023, singer Cassie Ventura, who previously dated Combs for over a decade, filed a 35-page federal lawsuit accusing Combs of violent abuse and coercion, claiming he forced her into drug-fueled sex parties he called “freak offs.” In the lawsuit, Ventura stated that Combs signed her to his record label, Bad Boy Records when she was 19 and he was 37; their business relationship soon became personal and volatile when Combs took complete control of her life.

A day after Ventura’s lawsuit, Combs agreed to a settlement. Ventura said, “I have decided to resolve this matter amicably on terms that I have some level of control. I want to thank my family, fans, and lawyers for their unwavering support.”

During that time, Combs denied the allegations, but after CNN released a disturbing video of the rapper physically assaulting and dragging Ventura in a hotel hallway, the rapper-producer later apologized in an Instagram video.

Four days after filing her lawsuit, Ventura, through her attorneys, asked the court to dismiss the lawsuit following an alleged multi-million dollar settlement, but while the lawsuit appeared to be quickly settled, it seemed to trigger more controversy because soon after, five more women come forward with similar accusations in quick succession and gave weight to a federal prosecution.

Four months after Ventura’s lawsuit was dismissed, armed Department of Homeland Security agents raided Combs' Holmby Hills mansion in Los Angeles and his Miami waterfront home. Among the items they seized included—narcotics, guns, ammunition, over 1,000 bottles of baby oil, and lubricants—are described as “freak off supplies” in the indictment, and prosecutors believe that much of this evidence bolsters their case.

This case is the most high-profile prosecution of a music industry figure since the conviction and downfall of R&B singer R. Kelly, who was charged with child sex crimes, sex trafficking and racketeering. Kelly is now serving a 20-year prison sentence and Combs’ case indicates a striking similarity between the two cases, which shows a troubling pattern of sexual misconduct in the music business.

Combs’ 30-year career once secured him as a cultural architect who shaped the careers of icons like The Notorious B.I.G. and Mary J. Blige and built out the alcoholic brand Ciroc, but the recent charges continue to threaten to upend his legacy."
