query,title,description,link,content
Avalanche debt payoff method comparison,3 Ways Bitcoin Could Impact The U.S. Economy,"What if bitcoin could address national debt, diversify reserves, and stimulate the U.S. industry? New data offers a macro perspective.",http://www.forbes.com/sites/mariepoteriaieva/2024/09/17/3-ways-bitcoin-could-impact-the-us-economy/,"Illustrative image of two commemorative bitcoins seen in front of the national flag of the United ... [+]

NURPHOTO VIA GETTY IMAGES

The narrative around bitcoin, once dominated by speculation and controversy, is gradually evolving. There is a growing interest in exploring its potential to positively impact the U.S. economy, championed by several pro-crypto politicians. Most recently, this perspective has also been actively promoted by the Republican presidential nominee Donald Trump, prompting broader public debate.

This momentum offers a good opportunity to assess whether this idea holds real economic merit. A closer examination reveals that bitcoin holds potential to reduce the U.S. national debt, diversify the country’s reserves, and help its oil industry.

Bitcoin Bitcoin +3.8% Could Help Reduce National Debt

Speaking at the Bitcoin 2024 conference in Nashville, Republican Senator Cynthia Lummis introduced an ambitious proposal to establish a strategic bitcoin reserve. Her bill, which she described as “our Louisiana Purchase moment,” outlines a plan to acquire 1 million BTC over five years. The senator also claimed that such a reserve would “serve as an additional store of value to bolster America’s balance sheet.”

The U.S. balance sheet is indeed in dire need of bolstering. With the national debt now towering at $35 trillion, the country is spending $0.95 trillion annually just to service it. Compounding the problem is the declining dominance of the dollar, which exacerbates the situation by reducing demand for Treasury securities – leaving the government with fewer resources to borrow and refinance the debt.

The recent European Central Bank report highlights this trend. While the euro’s share of global foreign exchange reserves has remained steady at around 20% over the past two decades, the US dollar’s share has dropped from over 70% to below 59%. Meanwhile, the share of “other currencies” has surged from 9% to almost 22%.

Crypto Confidential: Forbes' definitive guide to crypto and blockchain, delivered to your inbox every Saturday.

Get the latest news on special offers, product updates and content suggestions from Forbes and its affiliates.
Sign Up

By signing up, you agree to our Terms of Service, and you acknowledge our Privacy Statement. Forbes is protected by reCAPTCHA, and the Google Privacy Policy and Terms of Service apply.

Rising debt and shrinking borrowing capacity form a troubling trend, and one of these trajectories must be reversed. Reducing debt seems like the more feasible option, as the dollar’s decline is driven by factors beyond economics, notably the U.S. weaponizing the dollar, which has prompted many countries to reduce their over-reliance on it.

Reducing national debt traditionally involves unpopular political decisions, such as raising taxes and cutting social spending, making it seem particularly difficult in the current political climate. So, desperate times call for desperate – or creative – measures, and bitcoin might just be the answer.

Bitcoin appeals to people for the same reasons the dollar does not: free from the influence of any single nation's politics, it is provably scarce and enables borderless and relatively cheap transactions (especially with its layer-2 Lightning Network). Furthermore, with a market cap of just $1 trillion, bitcoin price has room for growth – a potential that could be realized rather quickly if the world’s largest economic power were to embrace it. By creating a strategic BTC reserve, the U.S. could trigger a bandwagon effect, potentially driving up the coin’s price and enabling the Treasury to pay down part of the national debt through capital gains.

The Impact Of A Bitcoin National Reserve

Diversification is key to financial resilience, whether in personal portfolios or national reserves. From this perspective, bitcoin stands out as a unique asset class that operates independently of traditional financial systems.

As shown by The Block, bitcoin’s correlation with stock indexes and gold fluctuates between 0.9 (highly correlated) and -0.9 (negatively correlated). This variability underscores its diversification potential, which the U.S. foreign reserves could strategically leverage.

Indeed, the U.S. foreign reserves are rather unvaried and modest given the scale of the American economy. Composed primarily of gold, special drawing rights with the IMF, and foreign currencies like the euro and yen, the U.S. official reserve assets now stand at only $246 billion ($908 billion if gold were recalculated at the current market price).

Enter bitcoin. By diversifying the foreign reserves, the leading cryptocurrency could help better manage external economic shocks that might threaten the dollar's stability, such as fluctuations in other reserve assets. A stronger, more diversified reserve would also enhance confidence in the dollar.

Additionally, a more robust foreign reserve would be invaluable in times of crisis. Black swan events often come without warning, and it’s generally wiser to put your eggs in different baskets to ensure you have some for tomorrow.

Sustainable Bitcoin Mining To Boost Oil Industry

The U.S. is probably the country where embracing bitcoin at a national level could produce the most significant catalytic impact. After China’s mining ban in 2021, America became a major hub for bitcoin mining, producing almost 38% of the total hashrate, according to the latest available data from CBECI (2022). Additionally, 13 out of the world’s 24 largest mining companies are registered in the U.S., as per CompaniesMarketCap.

Bitcoin mining involves using specialized rigs to secure the blockchain with large amounts of electricity in exchange for newly created BTC and transaction fees. Since miners are location-agnostic, they can be set up virtually anywhere with abundant and inexpensive energy. This flexibility drives innovation, and one of the most promising avenues for bitcoin mining in the U.S. today is capturing flared gas, a by-product of oil extraction. American oil producers like ExxonMobile and ConocoPhillips are already partnering with bitcoin mining companies that install their rigs in North Dakota oil fields. The higher bitcoin’s price climbs, the more profitable such operations become, while also reducing harmful emissions, boosting economic activity, and creating an additional wealth source for the country.

The Risks Of Adopting Bitcoin

For a seasoned bitcoiner who has maintained confidence in the asset through market’s ups and downs, the economic benefits of bitcoin may seem obvious. However, most people would question whether is it wise – or safe – for a country to gamble with its reserves?

These concerns are not without merit, and it’s crucial to map the risks before taking any important decision. Indeed, for the above scenario to hold, bitcoin must fulfill its initial promises. The blockchain must function as intended and real adoption must grow to ensure that U.S. market intervention does not simply inflate the coin’s price. Furthermore, the officials must consider issues like volatility, liquidity, and security very seriously.

While the risks are real, the potential rewards of adopting bitcoin on a national level could be transformative for the economy. Some countries, like El Salvador or Bhutan, have already recognized this.

Bitcoin In El Salvador And Bhutan

El Salvador is famous for becoming the first country to adopt bitcoin as legal tender, integrating it into several national projects aimed at stimulating economic growth and reducing debt. However, shortly after the introduction of the Bitcoin Law, the IMF warned the country of the risks on “financial stability, financial integrity, and consumer protection”, urging it to remove the legal tender status. El Salvador refused.

Three years in, El Salvador holds 5,875 BTC, now worth 34.5% more than the average purchase price. The country has also begun mining Bitcoin using geothermal energy from its volcanoes and has seen its bonds outperform the Invesco Emerging Markets Sovereign Debt ETF (PCYInvesco Emerging Markets Sovereign Debt ETF 0.0%) in 2023, benefiting from the momentum around Bitcoin spot ETFs. Even the IMF now cannot help but concede that “on bitcoin, many of the risks have not yet materialized”.

Overall, despite the grassroot bitcoin adoption remaining low at 12%, President Nayib Bukele views the project as a success. “It gave us branding, it brought us investments, it brought us tourism,” he said in a recent interview for Time Magazine.

With far less fanfare, the Asian nation of Bhutan has been quietly mining bitcoin since 2019. Arkham Intelligence’s recent research reveals that the country now holds 13,036 BTC - an impressive amount equivalent to over a quarter of its GDP. For one of the world's most isolated countries, bitcoin could be the way to bolster its financial independence, while its abundant hydroelectric resources provide a sustainable way to do so.

The U.S. has different economic goals from El Salvador or Bhutan, but investing in bitcoin aligns with them too. Moreover, given its immense economic power, even a relatively small investment could have an outsized return. While Bhutan holds 27% of its GDP in bitcoin and El Salvador 1%, Senator Warren’s proposed purchase of 1 million BTC would represent just 0.2% of the U.S. GDP (at current prices). Yet, such a move by the world's largest economy could potentially send bitcoin’s price “to the moon” and help address some of the country's serious economic challenges."
Avalanche debt payoff method comparison,Employers Are Tackling Gen Z’s Student Loan Debt,Employee benefits have existed almost as long as companies have had employees.,http://www.forbes.com/sites/jefffromm/2024/09/17/gen-z-student-loan-debt-is-being-tackled-by-employers/,"Employee benefits have existed almost as long as companies have had employees. Caesar Augustus apparently gave his retiring soldiers pensions in 13 BCE to stave off rebellions. Caesar didn’t have to worry about Glassdoor reviews or rants on social media, but he was forward leaning.

In today’s Gen Z-driven workplace, curated choices and values matter. Compensation is king, but benefits can still be a crucial differentiator.

Gen Z is redefining collaboration.

COURTESY PEXELS

“In today’s world of work, competitive pay is table stakes — it’s the bare minimum,” says Johnny C. Taylor, Jr., the president and CEO of SHRM, the Society for Human Resource Management. “Employees expect more, with holistic benefits packages becoming an increasingly critical part of what sets organizations apart in the fight to attract and retain talent.”

Taylor noted: “According to SHRM’s 2024 Employee Benefits Survey, health care, leave, and retirement savings and planning rank the highest in employer importance regarding benefits. But right below those three is a second tier of high-priority benefits: flexible work, family care, and professional and career development, which points toward employers’ desire to meet employee wants and needs in a tight labor market where many workers continue to value flexibility and professional development.”

Your Benefits — and Employee Perception — Are Part of Your Brand

Just as brands invest in consumer-facing brand-building, they realize they must also have strong employment/retention brands. Whether competing for the best talent or giving high-performers more reasons to build careers, they are starting to look more closely at how they are perceived as employers — especially as the workforce becomes more diverse.

Among the perks that employers believed would incentive team members to be loyal and stick around include:

● Vacation

CEO: C-suite news, analysis, and advice for top decision makers right to your inbox.

Get the latest news on special offers, product updates and content suggestions from Forbes and its affiliates.
Sign Up

By signing up, you agree to our Terms of Service, and you acknowledge our Privacy Statement. Forbes is protected by reCAPTCHA, and the Google Privacy Policy and Terms of Service apply.

● Health insurance

● Life insurance

● Parental leave policies

● Rewards for anniversaries

● Discounts on goods and services

● Matching grants for charitable donations

● Counseling resources

● Commuter benefits

● Travel perks

● Retirement plans

● And, most recently, remote work options and liberal PTO (personal time off)

Let’s not forget on-site activities, free snacks, a wide range of perks and celebrations, and off-site trips designed to boost company culture.

But What About Education?

Student loan debt has surpassed credit card debt and is now a whopping $1.75T. Who can even start thinking about what they’ll do when they’re 65 when those monthly payments loom?

Although all generations may be interested in “getting smarter” on their employer’s dime (or millions of dimes), younger team members are understandably more interested in digging themselves out of short-term debt than worrying about buying that home — like they might have been thirty years ago. Savvy companies must continue to research to understand what’s of the most significant value to the people they want to hire and retain.

How Do Companies Know What Their Employees Want?

Forrester Principal Analyst Betsy Summers says, “According to recent data from a joint survey to HR leaders from Forrester and HR Executive, an annual survey is the most commonly relied-on research method for understanding retention and engagement drivers.

Still, only 60% of organizations report doing surveys. More in-depth research, like journey mapping, monthly pulse surveys, and sentiment analysis, sits at 25% and 16%, respectively. Though every company might say they want to understand what attracts and retains their workforce, only those who invest in the right listening strategies and then act on the results are serious about it.”

Strong understanding of workforce needs led to introducing student loan-related benefits at the University of Miami, UHealth and the Miller School of Medicine. “Our approach is driven by a deep commitment to listening to our faculty and staff to offer benefits that can make a difference in their lives”, says Alison Mincey, their SVP and CHRO. “Recognizing the impact of student loan debt on our workforce, we established a student loan repayment assistance program that provides monthly contributions to repay student loans, resources to achieve loan forgiveness, and loan coaches for additional support. Thousands are already benefiting from this program.”

In addition, AI and other workplace transformations mean that employees need to continuously “upskill” or “reskill” to progress at their current company or move on to something bigger and better, increasing the cost of education.

“Student loan debt-related benefits have been solving critical staffing and turnover issues for employers in healthcare and education for a long time,” says Scott Thompson, CEO of Tuition.io. Scott continued, “We’re now seeing this strategy emerge in other industries looking to appeal to the next generation of workers, as Healthcare and 401(k) benefits just aren’t as relevant for younger, healthier employees with high living expenses.” While most employers are still on the sidelines some forward-looking and responsive companies stand out as setting the next standard of benefits for the future workforce.

Verizon is one of those companies. Earlier this year Verizon implemented its Secure Your Future program. Starting on day one of employment, employees can get up to a 6% company matching 401(k) contribution by making qualified student loan payments. “When the Secure 2.0 Act was passed, we saw it as an opportunity to offer another way for our employees to earn a matching contribution to our retirement plan,” stated Kevin Cammarata, Vice President of Benefits at Verizon. He continued, “We aimed to bridge the gap between employees’ immediate financial needs and long-term goals, which can be a differentiator with those that are wrestling with student loan debt.” Verizon reports over 1,800 employees have enrolled in the benefit since the program launched.

Technology also now plays a more significant role in benefits selection and administration for digitally savvy employers and employees. Self-service benefits management has become necessary for forward thinking companies, especially those trying to attract employees of all ages and stages.

Thompson summarized “Gen Z has been hit hardest by student loan debt, and employers must find solutions that ease the pain. By supporting individual financial wellness and career growth, companies can both stand out to this population and solve the damaging impact of turnover on organizational performance.”"
Avalanche debt payoff method comparison,Monster Beverage Stock Vs. Keurig Dr Pepper,"There is more to the comparison, and in the sections below, we discuss why we think MNST will outperform KDP in the next three years.",http://www.forbes.com/sites/greatspeculations/2024/09/17/monster-beverage-stock-vs-keurig-dr-pepper/,"Monster cans are seen at the airport in Balice near Krakow, Poland on May 18, 2024. (Photo by Jakub ... [+]

NURPHOTO VIA GETTY IMAGES

We believe that Monster Beverage stock is a better pick than its peer – Keurig Dr Pepper stock (NASDAQ: KDP). MNST stock trades at a higher multiple of 7x sales, versus 3.3x revenues for KDP. This gap in valuation makes sense, given Monster Beverage’s superior revenue growth, profitability, and financial position. There is more to the comparison, and in the sections below, we discuss why we think MNST will outperform KDP in the next three years. We compare a slew of factors, such as historical revenue growth, returns, and valuation in an interactive dashboard analysis – Keurig Dr Pepper vs. Monster Beverage, parts of which are summarized below.

1. Keurig Dr Pepper Stock Has Fared Better Than Monster Beverage

KDP stock has witnessed gains of 35% from levels of $30 in early January 2021 to around $40 now, vs. an increase of about 10% for MNST from $45 to $50 over the same period. In comparison, the broader S&P500 saw 45% gains over this roughly four-year period. However, the increase in these stocks has been far from consistent. Returns for KDP stock were 17% in 2021, -1% in 2022, and -4% in 2023, while MNST stock saw returns of 4%, 6%, and 13% over these years, respectively. In comparison, returns for the S&P 500 have been 27% in 2021, -19% in 2022, and 24% in 2023 — indicating that KDP and MNST underperformed the S&P in 2021 and 2023.

In fact, consistently beating the S&P 500 — in good times and bad — has been difficult over recent years for individual stocks; for heavyweights in the Consumer Staples sector including WMT, PG, and COST, and even for the megacap stars GOOG, TSLA, and MSFT. In contrast, the Trefis High Quality Portfolio, with a collection of 30 stocks, has outperformed the S&P 500 each year over the same period. Why is that? As a group, HQ Portfolio stocks provided better returns with less risk versus the benchmark index; less of a roller-coaster ride, as evident in HQ Portfolio performance metrics.

2. But Monster Beverage Has Seen Better Revenue Growth

Keurig Dr Pepper saw its sales rise at an average annual rate of 8.5% from $11.6 billion in 2020 to $14.8 billion in 2023, while Monster Beverage’s sales grew at an average rate of 15.8% from $4.6 billion to $7.1 billion over the same period.

Keurig Dr Pepper’s revenue growth benefited from at-home demand for K-Cups due to a sudden surge in at-home consumption during the pandemic phase. While the company has benefited from pricing gains in recent years, its U.S. coffee segment sales have been trending lower lately, amid a weakening consumer spending environment and a shift to lower price point alternatives. The company has the edge over other beverage companies as its coffee segment remains an important long-term growth driver, with people moving away from carbonated drinks and replacing them with other beverages. That said, Keurig Dr Pepper’s refreshment beverages business has been doing better lately.

Monster Beverage’s revenue growth has been driven by a solid demand for its energy drinks. New product launches and expansion in international markets along with a pricing growth has also bolstered its overall top-line expansion lately. For perspective, its average sales per case (24 eight-ounce servings) declined from $9.06 in 2020 to $8.82 in 2022 but saw a sharp rebound to $9.01 in 2023. The total number of cases sold surged by 52% between 2020 and 2023. Monster Beverage will likely continue to see its sales trend higher, led by volume and pricing gains.

Investing Digest: Know what's moving the financial markets and what smart money is buying with Forbes Investing Digest.

Get the latest news on special offers, product updates and content suggestions from Forbes and its affiliates.
Sign Up

By signing up, you agree to our Terms of Service, and you acknowledge our Privacy Statement. Forbes is protected by reCAPTCHA, and the Google Privacy Policy and Terms of Service apply.

3. Monster Beverage Is More Profitable

Keurig Dr Pepper’s operating margin of 21.6% in 2023 declined marginally from 21.9% in 2020, while Monster Beverage’s operating margin contracted from 35.5% to 27.4% over this period. This can be attributed to supply chain constraints and falling prices for Monster Beverage. This situation reversed in 2023, with support from pricing actions and the company’s decreased reliance on imported cans. Looking at the last twelve-month period, Monster Beverage’s operating margin of 27.3% fares slightly better than 23% for Keurig Dr Pepper.

4. Monster Beverage Also Offers Lower Financial Risk

Looking at financial risk, Monster Beverage has an edge over Keurig Dr Pepper. Its 1% debt as a percentage of equity is much lower than 32% for the latter. Moreover, its 19% cash as a percentage of assets is significantly higher than 1% for Keurig Dr Pepper, implying that Monster Beverage has a better debt position and more cash cushion.

5. The Net of It All

We see that Monster Beverage has demonstrated better revenue growth, is more profitable, and has a better financial position. Looking at the prospects, we believe MNST is still the better choice of the two, despite its rising valuation multiple. KDP stock trades at 3.3x trailing revenues, versus the 3.5x average P/S ratio seen over the last five years. In contrast, MNST stock trades at 7x revenues, versus the 5x average P/S ratio seen over the last five years. This can be attributed to strong sales growth and a rebound in operating margins lately, a trend expected to continue in the near-term. Looking forward, Monster Beverage will likely continue to enjoy a higher valuation multiple, given its recent pricing actions and focus on cutting costs. There has been a robust growth in demand for energy drinks, evident from Monster Beverage’s 52% growth in number of cases sold since 2020. This trend is expected to continue, with the company’s new product launches and expansion in international markets.

While MNST may outperform KDP in the next three years, it is helpful to see how Keurig Dr Pepper’s peers fare on metrics that matter. You will find other valuable comparisons for companies across industries at Peer Comparisons.

KDP & MNST Return Compared With Trefis Reinforced Portfolio 

TREFIS

Invest with Trefis Market Beating Portfolios

See all Trefis Price Estimates"
