query,description,link,content
benefits of high-yield savings accounts vs traditional savings accounts,No disponible,https://www.thebalancemoney.com/what-is-an-interest-checking-account-315272,"PHOTO: FG TRADE / GETTY IMAGES
DEFINITION

An interest checking account is a type of checking account that earns interest on your account balance.

Key Takeaways
An interest checking account accrues interest on your account balance.
Standard interest checking accounts offer less interest but fewer requirements and a simpler interest structure, whereas rewards checking accounts offer more interest in exchange for more requirements and a more complex interest structure.
These accounts can be opened online or in person at banks or credit unions but may require a check of your ChexSystems report.
Definition and Example of an Interest Checking Account

An interest checking account is a checking account that accrues interest on the money in it. As long as the requirements to earn interest are manageable, the interest benefit of these accounts gives savers an opportunity to grow their deposits on autopilot. The interest is usually expressed as an annualized rate known as ""annual percentage yield"" (APY). It's calculated as a percentage of your balance and paid out periodically.

Alternate name: Interest-bearing checking account

For example, if you deposit $10,000 in an interest checking account with a 0.20% APY, after a year of savings you'll earn an extra $20.00.1

How an Interest Checking Account Works

Traditionally, checking accounts are not interest-bearing accounts as savings accounts are, as they’re designed for short-term cash that you’ll spend soon. Savings accounts are better-known for earning interest, but these accounts ordinarily limit how often you can make certain withdrawals from the account.

Interest checking accounts, available from banks and credit unions, incorporate key features from both of these account types. You can use them as standard checking accounts; they come with a debit card for purchases, checks for spending, automatic electronic payments, and online bill payments. All the while, you'll earn interest on your balance as with a savings account. This interest rate is applied to your balance and paid out according to the terms in your contract with the bank or financial institution.

The catch is that you'll sometimes need to pay a higher monthly fee and maintain a minimum account balance to earn that interest in comparison to what you'd pay for a standard checking account.2 However, some interest checking accounts, usually online-only accounts, impose none of these requirements.

For example, suppose that ABC Bank offers up to 0.60% APY on its interest checking account but not on all balances. It offers 0.60% APY on balances of $25,000 and above, 0.30% on balances between $10,000 and $24,999, and only 0.20% on balances below $10,000. In addition, you need to maintain an average monthly balance of $15,000 to avoid a $15 monthly fee. You'll need to maintain a minimum average monthly balance of $15,000 to avoid fees, but you'll need to keep another $10,000 in the account to earn the top rate.

Note

The interest you earn on these accounts is subject to taxation.

Types of Interest Checking Accounts

These accounts fall into one of two categories:

Standard interest checking accounts
Reward checking accounts
Standard Interest Checking Accounts

These accounts are available at both brick-and-mortar and online-only banks and credit unions and pay less interest but impose minimal requirements.

Requirements to earn interest: You'll typically earn interest simply by holding deposits that meet the institution's threshold for earning the stated APY.
Interest structure: Some pay the same interest rate on all balances, whereas others pay a higher rate as your balance increases, as in the earlier example of ABC Bank.
Fees: Potential fees include monthly maintenance fees, overdraft fees, and foreign ATM fees.

Capital One 360 Checking, Ally Interest Checking, and Citi Elevate High-Yield Checking are all examples of this type of interest checking account.

Rewards Checking Accounts

Sometimes called ""high-yield"" or ""high-interest checking accounts,"" these accounts usually pay a more competitive APY than standard interest checking accounts—sometimes even higher than long-term certificates of deposit (CDs)—as a reward for meeting more stringent requirements. In addition, they're harder to find—community banks and credit unions are your best bets.

Requirements to earn interest: Common requirements for earning the lucrative APY on these checking accounts include the need to use your debit card a certain number of times per month (and in some cases, for a certain purchase amount each time), receive one or more direct deposits or ACH payments each month, enroll in online banking, and receive electronic bank statements.3
Interest structure: These accounts often come with a tiered interest structure, meaning that you'll earn the top rate on balances of up to a certain amount and a lower rate beyond that balance. If you don't meet the requirements in a given month, you'll typically earn interest at a lower rate. For example, a bank might offer up to 4% APY on its rewards interest checking account but only offer the top rate on balances of up to $3,000, 2% on balances between $3,000 and $10,000, and only 0.10% on balances above $10,000.
Fees: The upside of these accounts is that they often impose no minimum balance requirement or monthly fee. However, they're still subject to other common fees, such as overdraft and foreign ATM fees.

The Consumers Credit Union Reward Checking Account and Elements Financial Credit Union High Interest Checking Account are examples of this type of account.

Note

To meet the required number of debit card transactions each month to earn the top interest rate, consider setting up recurring purchases such as gift cards or small donations to charities.

Interest Checking Accounts vs. Money Market Accounts

While not technically checking accounts, money market accounts are similar accounts that may serve as an alternative for consumers who seek an attractive APY without the tougher requirements of a rewards checking account.

INTEREST CHECKING ACCOUNT	MONEY MARKET ACCOUNT
More rules to earn interest on rewards accounts	Fewer requirements to earn interest
No withdrawal limits	Traditionally imposes withdrawal limits
Better for everyday spending	Better for emergency savings or occasional spending

In terms of account features, money market accounts are similar to standard interest checking accounts; you generally only need to keep qualifying deposits in the account to earn interest, which might be the same at all balance tiers or yield more interest as your balance increases. Monthly maintenance fees can apply.

These accounts fall under the category of savings accounts but typically pay more than traditional savings accounts. In addition, they often pay more interest than standard interest checking accounts but less than rewards checking accounts.

Money market accounts typically offer a debit card and check-writing privileges. However, check writing is more limited, as are external transfers, as money market accounts, like savings accounts, have traditionally only allowed consumers to make six withdrawals per month.4

Note

The withdrawal restriction was lifted in April 2020 but may still apply at some financial institutions. Inquire with yours for the latest rules.5

As such, money market accounts are a good fit for emergency funds but aren't designed for everyday spending. Interest checking accounts don't limit withdrawals in this way, making them more suitable for frequent check writing.

How to Get an Interest Checking Account

You can open an account online, or, if the financial institution has branches, in person. Simply search for the institution online to find and visit its website.

When you apply for an interest checking account, you'll be asked to provide some form of government identification, personal information such as your Social Security number, and an opening deposit (if required).

Many institutions will reference your ChexSystems report, which details your past deposit account activities, when deciding whether to approve or deny your application.6 If approved, you can register your account for online access and will receive your debit card in the mail.

Was this page helpful?
SOURCES"
current annual percentage yield for high-yield savings accounts,No disponible,https://www.thebalancemoney.com/how-to-build-your-savings-while-earning-rewards-4843937,"Maximizing your savings comes down to finding the right savings vehicle. And it’s not all about interest rates. Even in a low-interest market, you can make the most of your savings while accommodating your lifestyle and budget. The key is to look for a savings account that matches your individual needs. So, what are the best options to choose from? Following a few simple steps can help you determine which type of savings vehicle is right for you.

Determine Your Savings Needs

Before you can settle on the best savings account, it’s important to have a clear sense of your overall financial goals. This means creating a budget and identifying how much of your income you can spend and how much you can save. The best way to do this is by tracking your current essential and nonessential expenses—including rent, utilities, groceries, and entertainment—and using that information to create a monthly savings goal. 

A good rule of thumb is to save around 5% to 8% of your current income, though you can adjust this based on your specific needs and circumstances. Once you’ve established your savings goal, you can look for a savings vehicle that will offer you the best return on investment while also allowing you to maintain your desired lifestyle.  

Understand the Different Savings Options

High-yield savings accounts have become a big trend over the past few years, but they’re not the only way to maximize savings. Savings vehicles such as CDs and money market accounts can also be good options for long-term savers, though it’s worth noting that they don’t offer the same level of liquidity as traditional savings accounts.

Given the current circumstances, it’s also important to select an account that offers you the flexibility to securely and confidently bank from home. Digital accounts can provide this type of flexibility, and when combined with other benefits, such as direct deposit of savings, they can provide the best overall customer experience.

For those looking for a digital account that can help maximize savings with rewards rather than earned interest, the Bask Savings Account earns one American Airlines AAdvantage® mile for every dollar saved annually—a great alternative to traditional savings solutions.

Opt for a Savings Vehicle That Fits Your Financial Needs and Lifestyle

The key to selecting the right type of savings account is to determine which option aligns most closely with your financial goals. Ask yourself what features are most important and what you’re looking to get out of your savings. If you need easy access to cash, a digital savings account is likely your best option. From there, it’s important to focus on other features that most closely match your needs. 

If you’re looking for a long-term savings solution and aren’t as concerned about interest rates or rewards, a CD or money market account could be a good option.

On the other hand, if you’re looking for a lifestyle-focused option that can offer you a more rewarding alternative to an interest-based account, the Bask Savings Account could be right for you. By earning AAdvantage® miles rather than interest, the Bask Savings Account can serve as a complement to other savings solutions while helping you go a lot further. 

In fact, based on the current industry average annual percentage yield of 0.10%*, if you have $5,000 in savings, you’re likely to earn only $5.00 in an average year with a traditional savings account, whereas you could earn 5,000 AAdvantage® miles with a Bask Savings Account, making it easier to travel once current circumstances allow for it. This can be a great way to earn that last batch of miles toward a dream vacation, a trip to see family, or even a honeymoon.

Whatever your future travel goals, choosing an account that helps you build savings while earning miles can help you outsmart interest, especially in the current climate. And because Bask Bank is FDIC insured, your savings will be protected up to $250,000 per depositor, per ownership category, even if circumstances change.

Selecting the right savings account doesn’t have to be complicated. By figuring out your individual needs and the features that most closely align with them, you can choose the right savings vehicle and start growing your savings. 

Note

Industry average annual percentage yield of 0.10% is based on the FDIC calculated national rate effective July 18, 2022.1

Disclosures

Bask Bank and BankDirect are divisions of Texas Capital Bank, N.A. Member FDIC. The sum of your total deposits with (i) Bask Bank; (ii) BankDirect; and (iii) Texas Capital Bank, N.A. are insured for up to $250,000. Additional coverage may be available depending on how your assets are held.

The value of this offer will be reported to the IRS, and the recipient is responsible for any federal, state, or local taxes on this offer.

Was this page helpful?
SOURCES"
current annual percentage yield for high-yield savings accounts,No disponible,https://www.thebalancemoney.com/how-to-earn-more-interest-on-savings-without-investing-5219531,"PHOTO: 

THE BALANCE/ALICE MORGAN

Dear Kristin,

I've finally reached a place in my life where my savings account feels really robust and my parents have mentioned that I should start exploring other options to make sure I'm maximizing my interest. I feel so overwhelmed and intimidated by this—what are my other options?

I don't feel prepared to jump into stocks or property investments, which I know are common routes for people my age. Are there easier ways or types of accounts I can leverage to ensure my money isn't just sitting collecting cobwebs but is actually building sizable interest?

Sincerely,

Unsavvy Saver

Dear Unsavvy, 

Congratulations on saving up a sizable amount of money! You don’t mention how much you’ve managed to save, but at minimum, you’ll want to set aside at least three to six months’ worth of expenses in an emergency fund (six or more is even better).1

After that, you can build up more interest on the rest of your savings by taking advantage of a high-yield savings account. It’s a savings account that has a higher interest rate than your typical savings account—known as the annual percentage yield (APY)—and is usually offered by online-only banks. While you may not want to move all your money to such an account (you may have use for the financial services offered by your current bank), it’s something to consider.

You could also place your money into a money market account, which is a combination of a savings and checking account that gives you a higher interest rate. Money market accounts are not as flexible as your average checking account, though. There are limits on the number of payments and withdrawals you can make per month by check, electronic transfer, draft, and debit card.2

A CD (certificate of deposit) is another low-risk way to earn interest. A CD is a type of savings account that pays you a fixed amount of interest at the end of a specified term, such as six months or one year. The catch here is that you won’t be able to touch your money (without a penalty) until the term is up and the CD has reached its maturity date.3

I hear you when you say you are overwhelmed and intimidated by investing, but you write that you want to earn a “sizable” amount of interest on your funds, and investing is truly the best way to do that. Investing doesn’t need to be difficult; there are less risky, easier types of investments you can explore as a beginner.

While I generally suggest new investors invest in ETFs (exchange-traded funds) or index funds, it seems that both are out of your comfort zone. It sounds like you’d be a “conservative” investor—you want low-risk investments that can still beat inflation. Lucky for you, there are a whole host of investments to choose from. Bond funds and balanced funds might be good choices. Just remember: “Low risk” doesn’t mean “no risk” and you may want to seek further advice from a financial advisor. 

I do want to stress that with that low risk, you are also looking at a low reward. If you want to build up a sizable amount of interest to help grow your funds, you’re going to want to expand into other investments. Start small, and build up your investments over time. 

Good luck!

-Kristin

If you have questions about money, Kristin is here to help. Submit an anonymous question and she may answer it in a future column.

Was this page helpful?
SOURCES"
current annual percentage yield for high-yield savings accounts,No disponible,https://www.thebalancemoney.com/the-new-savings-account-that-can-help-you-save-on-travel-4843943,"With so many savings options, it’s hard to know which one to pick—especially in a low-interest environment. This is where having goal-specific savings accounts can come in handy. These can include a high-yield savings account for higher rates of return, a money market account for long-term savings, and an awards-focused account to help you build up miles for future travel.

Bask Bank recently came out with this type of savings account, and it could significantly change the way you think of saving for travel. Here’s what you need to know about Bask Bank’s new savings account.

Travel Rewards That Could Outpace Interest

Offering a unique type of return, the Bask Savings Account awards savers with American Airlines AAdvantage® miles rather than interest. As a result, savers can earn one AAdvantage® mile for every dollar they save annually, and that can translate into big travel awards over the course of a year. 

As an added bonus, Bask Bank is currently offering another benefit through Aug. 31, 2022. If you deposit and maintain a minimum daily account balance of $5,000 for 90 consecutive days out of the first 120 days following the initial account opening, you’ll earn 1,000 bonus AAdvantage® miles. This is a great way to kick off your savings, and it can help you quickly earn miles for a future trip.

Since miles are deposited monthly, having a Bask Savings Account means your miles never expire. You’ll be able to plan a trip whenever global circumstances allow for it, without having to worry about what will happen to the miles you’ve earned. 

The Ability to Overcome a Low-Interest Environment 

Interest rates have dropped significantly over the last few years but have bounced higher somewhat thanks to the Federal Reserve hiking interest rates to combat inflation in 2022. Interest rates on traditional savings accounts are still historically low, with the standard rate at 0.10% APY. This has affected both traditional savings accounts and savings vehicles such as CDs, making an awards-based account a better option for many savers.12

Note

The industry average annual percentage yield of 0.10% is based on the FDIC calculated national rate effective July 2022.2

To put this into perspective, if you were to have $60,000 earning the industry average of 0.10% APY in a traditional savings account, you would earn $60 over the course of one year. By comparison, in a Bask Savings Account, that same $60,000 would earn 60,000 AAdvantage® miles over the same time period (before factoring in any bonus offers). That translates into a much higher rate of return, making it easy to save on travel and to plan trips you may not otherwise have considered. 

The Flexibility to Make Your Savings Fit Your Lifestyle

In addition to helping savers earn AAdvantage® miles, the Bask Savings Account offers a unique way to upgrade your travel. This can be a great option for those looking to supplement their travel budgets and make their travel dreams a reality once current global circumstances allow for it. By offering a new way to maximize savings, Bask Bank is a great option for those looking for a new way to save that fits their lifestyle. 

With different types of savings accounts becoming more popular, being able to have goal-specific accounts can help you meet multiple goals at once while making saving a more rewarding experience. If you’re looking to maximize your savings while planning your next adventure, a Bask Savings Account could be right for you.


Disclosures
All Bonus Award offers are valid through Aug. 31, 2022. Terms and Conditions apply.
AAdvantage® bonus miles are awarded within ten business days upon meeting offer qualifications and may take 6-8 weeks to post to your AAdvantage® account.
The value of this offer will be reported to the IRS, and the recipient is responsible for any federal, state, or local taxes on this offer.
Bask Bank is a division of Texas Capital Bank. Member FDIC. The sum of your total deposits with (i) Bask Bank and (ii) Texas Capital Bank are insured for up to $250,000. Additional coverage may be available depending on how your assets are held.
Was this page helpful?
SOURCES"
