query,description,link,content
potential earnings comparison high-yield vs traditional savings,No disponible,https://www.thebalancemoney.com/what-is-an-interest-checking-account-315272,"PHOTO: FG TRADE / GETTY IMAGES
DEFINITION

An interest checking account is a type of checking account that earns interest on your account balance.

Key Takeaways
An interest checking account accrues interest on your account balance.
Standard interest checking accounts offer less interest but fewer requirements and a simpler interest structure, whereas rewards checking accounts offer more interest in exchange for more requirements and a more complex interest structure.
These accounts can be opened online or in person at banks or credit unions but may require a check of your ChexSystems report.
Definition and Example of an Interest Checking Account

An interest checking account is a checking account that accrues interest on the money in it. As long as the requirements to earn interest are manageable, the interest benefit of these accounts gives savers an opportunity to grow their deposits on autopilot. The interest is usually expressed as an annualized rate known as ""annual percentage yield"" (APY). It's calculated as a percentage of your balance and paid out periodically.

Alternate name: Interest-bearing checking account

For example, if you deposit $10,000 in an interest checking account with a 0.20% APY, after a year of savings you'll earn an extra $20.00.1

How an Interest Checking Account Works

Traditionally, checking accounts are not interest-bearing accounts as savings accounts are, as they’re designed for short-term cash that you’ll spend soon. Savings accounts are better-known for earning interest, but these accounts ordinarily limit how often you can make certain withdrawals from the account.

Interest checking accounts, available from banks and credit unions, incorporate key features from both of these account types. You can use them as standard checking accounts; they come with a debit card for purchases, checks for spending, automatic electronic payments, and online bill payments. All the while, you'll earn interest on your balance as with a savings account. This interest rate is applied to your balance and paid out according to the terms in your contract with the bank or financial institution.

The catch is that you'll sometimes need to pay a higher monthly fee and maintain a minimum account balance to earn that interest in comparison to what you'd pay for a standard checking account.2 However, some interest checking accounts, usually online-only accounts, impose none of these requirements.

For example, suppose that ABC Bank offers up to 0.60% APY on its interest checking account but not on all balances. It offers 0.60% APY on balances of $25,000 and above, 0.30% on balances between $10,000 and $24,999, and only 0.20% on balances below $10,000. In addition, you need to maintain an average monthly balance of $15,000 to avoid a $15 monthly fee. You'll need to maintain a minimum average monthly balance of $15,000 to avoid fees, but you'll need to keep another $10,000 in the account to earn the top rate.

Note

The interest you earn on these accounts is subject to taxation.

Types of Interest Checking Accounts

These accounts fall into one of two categories:

Standard interest checking accounts
Reward checking accounts
Standard Interest Checking Accounts

These accounts are available at both brick-and-mortar and online-only banks and credit unions and pay less interest but impose minimal requirements.

Requirements to earn interest: You'll typically earn interest simply by holding deposits that meet the institution's threshold for earning the stated APY.
Interest structure: Some pay the same interest rate on all balances, whereas others pay a higher rate as your balance increases, as in the earlier example of ABC Bank.
Fees: Potential fees include monthly maintenance fees, overdraft fees, and foreign ATM fees.

Capital One 360 Checking, Ally Interest Checking, and Citi Elevate High-Yield Checking are all examples of this type of interest checking account.

Rewards Checking Accounts

Sometimes called ""high-yield"" or ""high-interest checking accounts,"" these accounts usually pay a more competitive APY than standard interest checking accounts—sometimes even higher than long-term certificates of deposit (CDs)—as a reward for meeting more stringent requirements. In addition, they're harder to find—community banks and credit unions are your best bets.

Requirements to earn interest: Common requirements for earning the lucrative APY on these checking accounts include the need to use your debit card a certain number of times per month (and in some cases, for a certain purchase amount each time), receive one or more direct deposits or ACH payments each month, enroll in online banking, and receive electronic bank statements.3
Interest structure: These accounts often come with a tiered interest structure, meaning that you'll earn the top rate on balances of up to a certain amount and a lower rate beyond that balance. If you don't meet the requirements in a given month, you'll typically earn interest at a lower rate. For example, a bank might offer up to 4% APY on its rewards interest checking account but only offer the top rate on balances of up to $3,000, 2% on balances between $3,000 and $10,000, and only 0.10% on balances above $10,000.
Fees: The upside of these accounts is that they often impose no minimum balance requirement or monthly fee. However, they're still subject to other common fees, such as overdraft and foreign ATM fees.

The Consumers Credit Union Reward Checking Account and Elements Financial Credit Union High Interest Checking Account are examples of this type of account.

Note

To meet the required number of debit card transactions each month to earn the top interest rate, consider setting up recurring purchases such as gift cards or small donations to charities.

Interest Checking Accounts vs. Money Market Accounts

While not technically checking accounts, money market accounts are similar accounts that may serve as an alternative for consumers who seek an attractive APY without the tougher requirements of a rewards checking account.

INTEREST CHECKING ACCOUNT	MONEY MARKET ACCOUNT
More rules to earn interest on rewards accounts	Fewer requirements to earn interest
No withdrawal limits	Traditionally imposes withdrawal limits
Better for everyday spending	Better for emergency savings or occasional spending

In terms of account features, money market accounts are similar to standard interest checking accounts; you generally only need to keep qualifying deposits in the account to earn interest, which might be the same at all balance tiers or yield more interest as your balance increases. Monthly maintenance fees can apply.

These accounts fall under the category of savings accounts but typically pay more than traditional savings accounts. In addition, they often pay more interest than standard interest checking accounts but less than rewards checking accounts.

Money market accounts typically offer a debit card and check-writing privileges. However, check writing is more limited, as are external transfers, as money market accounts, like savings accounts, have traditionally only allowed consumers to make six withdrawals per month.4

Note

The withdrawal restriction was lifted in April 2020 but may still apply at some financial institutions. Inquire with yours for the latest rules.5

As such, money market accounts are a good fit for emergency funds but aren't designed for everyday spending. Interest checking accounts don't limit withdrawals in this way, making them more suitable for frequent check writing.

How to Get an Interest Checking Account

You can open an account online, or, if the financial institution has branches, in person. Simply search for the institution online to find and visit its website.

When you apply for an interest checking account, you'll be asked to provide some form of government identification, personal information such as your Social Security number, and an opening deposit (if required).

Many institutions will reference your ChexSystems report, which details your past deposit account activities, when deciding whether to approve or deny your application.6 If approved, you can register your account for online access and will receive your debit card in the mail.

Was this page helpful?
SOURCES"
high-yield savings accounts reviews and performance,No disponible,https://www.thebalancemoney.com/how-can-i-easily-open-bank-accounts-315723,"PHOTO: 

THE BALANCE / MADDY PRICE

To open a bank account, you'll need to first choose a bank and provide it with some necessary information, including your identification and proof of address. You'll usually need to be 18 to meet the bank's eligibility requirements. Finally, you might need to fund the account or have a minimum balance to avoid fees.

Here's what you need to know about opening a new bank account, including tips on choosing a bank and the type of account.

Key Takeaways
To open an account, you'll need to bring a government-issued ID, your identification number, and your physical and mailing address.
When deciding on an account, you'll want to read the disclosures so you can learn about any account fees or balance minimums.
You can decide what bank or account you want based on the features you're looking for, whether it's high interest rates, low balance minimums, no ATM fees, or something else.
What You Need to Open a Bank Account

When you open a new bank account, you'll need to give the bank or credit union documentation so they can verify your identity.

Have the following items ready:

A government-issued ID (such as a driver’s license, passport, or military ID)
Your identification number
Proof of your physical and mailing address
An initial deposit (if required)

If you don’t have a government-issued ID, you may be able to use another form of ID. Ask your bank what other forms of identification it can accept.

Depending on your situation, your identification number may be your Social Security number, alien identification card number, Individual Tax Payer Identification Number, or another government-issued ID number. If you're a United States citizen, your identification number is most likely your Social Security number.

You'll need to provide this information in some form whether you're opening up an account online or in person.1

Choose a Bank or Credit Union

After you have all of your documents together, you'll want to choose the best bank or credit union for your situation. If you know what type of account you want, you can look for the best deals, whether you're in the market for an online checking account, a high-yield savings account, or something else.

There are three basic categories of financial institutions:

Banks, including community banks and big banks: These might be well-known brands in your local community, or nationwide. They should offer most of the basic services you need, including checking and savings accounts, debit and credit cards, mortgages, personal loans, and more.2
Credit unions: A credit union is a customer-owned financial institution that provides many of the same services and products that banks provide. If you opt to join one of these not-for-profit institutions, you'll often enjoy competitive rates because they're not necessarily trying to maximize profits. But that’s not always the case—so review fee schedules carefully.
Online banks and credit unions: These institutions operate entirely online. There’s no branch to visit (or pay for), and you’ll handle most service requests yourself. If you have access to and are comfortable using a computer or mobile device—and performing basic banking transactions—an online bank can help you reduce your fees and earn higher interest rates on savings accounts.3
Note

You might want to have accounts with multiple banks. For example, you may decide to open an online bank account and a brick-and-mortar bank to keep your fees low and maintain the ability to visit an in-person bank if you need to.

Choosing an Account

If you're not sure what type of account you want, consider what your needs are.

Checking accounts: These accounts are typically used to make payments and receive direct deposits.
Savings accounts: These accounts allow you to put your savings aside and earn interest on the money you're not currently using.
Money market accounts: These products sometimes earn slightly more interest than savings accounts (while maintaining your access to cash). You may also have debit and check writing options with these accounts.4
Certificates of deposit (CDs): These products can earn much more than savings accounts but require you to lock up your funds for a certain period.5

Within one of the above categories, a bank may offer multiple products, each with a different name and level of service. These accounts may have different minimum balance thresholds, fees, or interest rates.

A general rule of thumb is to choose an option with a mix of features and fees that meet your needs and budget. For example, if you think you won’t keep a lot of money in the account, you may want to open a bank account with a low initial deposit and low or no minimum balance and fee requirements so you don’t get stuck paying unnecessary fees.

Note

In general, you'll only want to bank where your money is protected by FDIC insurance (or NCUSIF coverage if you use a credit union).

Your Financial History

Your financial history doesn’t need to be impeccable to open a bank account, but it may play into the bank’s decision to approve or deny your application. Your bank or credit union might use ChexSystems, a targeted consumer reporting agency that tracks checking and savings accounts, to determine how much risk a potential customer might pose to the institution where they’re applying for an account. ChexSystems is the banking equivalent of the credit reporting bureaus. 

You don’t necessarily need good credit to get a bank account, but if you're having trouble opening an account, you might want to review your credit report and get a copy of your ChexSystems report.

Opening an Account

Once you've decided on a bank and type of account, you'll need to provide the bank with your information and sign some paperwork.

You’ll have to agree to abide by certain rules and accept responsibility for certain activities in your accounts. Make sure you read the disclosures before opening an account with the bank. Pay special attention to any fees, and make sure you know how often you can make withdrawals and deposits.

Note

If you’re under 18 years old, you’ll need someone over age 18 to open the account with you. You still might be able to use a debit card and online banking, and you can eventually get your own account.

Print, Sign, and Mail (If Required)

If you're opening a bank account online, you may have to print, sign, and mail a document to the bank before the account is opened. Some banks use electronic disclosure and consent to make the banking relationship legally binding—you can do everything online.6

Others still require a signed document to open an account.7 Until the bank receives the documents, your account is not active.

Fund Your Account

If you’re opening a checking or savings account, you’ll often need to make an initial deposit into the account. Sometimes, this is required as part of the opening process, and other times, you can do it after the account is up and running. There are several ways to fund your account:

Deposit cash: It should be available for you to spend within one business day.8
Deposit a check or money order: The funds should be available within a few business days after you make the deposit, but it may take longer because it's a new account.9
Set up direct deposit with your employer: If your company offers this, instead of getting a physical paycheck, your earnings will be sent directly to your new account.
Transfer funds electronically: You can move money from another bank account to make your initial deposit.
Start Using the Account

If you followed all the steps, you should have a brand new bank account in your name. It should be ready to use within a few minutes to a few days. For checking and savings accounts, keep an eye out for a debit card or ATM card in the mail.

You might also get a checkbook or be able to order one. To make the most of your account, you may be able to sign up for account features that help you manage your money, including:


Online bill pay: This feature allows you to pay bills electronically.
Remote check deposit: Your bank’s mobile app may allow you to deposit checks remotely so that you don’t have to make trips to a branch or fill out deposit slips.
Alerts: Sign up for text or email alerts so you know when your account balance is running low or when large withdrawals happen.
Frequently Asked Questions (FAQs)
What do I need to open a bank account?

When you open a new bank account, you'll need to provide identification so that the bank can verify your identity. You'll want to bring a government-issued ID, like a driver's license, passport, or military ID. If you don't have a government-issued ID, you should ask your bank what other forms of identification it can accept. You'll need to provide your identification number, which might be a Social Security number, alien identification number, or other government-issued ID number. Finally, you'll need proof of your physical and mailing address, as well as an initial deposit, if required.

How much money do you need to open a bank account?

Every bank has its own requirements for opening account balances. Most banks will require an initial deposit that ranges from $25 to $100. However, you can also find a few banks that will allow you to open an account without any money down. Be sure to ask the bank how much money you need to deposit to open an account and what the minimum balance is to avoid fees. Make sure any bank you put your money in is FDIC-insured.101

How long does it take to open a bank account?

The application process for a new bank account is fairly quick. You can usually apply online in 15 minutes or less, though it may take a bit longer in person. It may also take a few days for the bank to verify your information and allow you to begin using your account.

Was this page helpful?
SOURCES"
