query,description,link,content
benefits of high-yield savings accounts vs traditional savings accounts,No disponible,https://www.thebalancemoney.com/no-penalty-cd-vs-savings-account-which-is-better-5235784,"PHOTO: 

VIOLETASTOIMENOVA / GETTY IMAGES

Savings accounts let you deposit and withdraw as much money as you want, typically whenever you want (some banks restrict certain types of withdrawals to six per month). A no-penalty CD is often seen as a way to earn a slightly higher interest rate than with a savings account, but in turn, you're much more limited as to when you can make deposits and withdrawals. If you're trying to decide between the two, we'll help by highlighting some important differences.

What’s the Difference Between No-Penalty CDs and Savings Accounts?
 	SAVINGS ACCOUNTS	NO-PENALTY CDS
APY	Usually slightly lower	Usually slightly higher
CHANGING APYS	Can change at any time	Does not change 
LIMITS ON DEPOSITS	No limits; whenever you want, in any amount	Once open, you can’t deposit any more money
LIMITS ON WITHDRAWALS	Six withdrawals per month, in any amount	No withdrawals are allowed until the term ends or you make an early withdrawal
AVAILABILITY	Available at any bank or credit union	Less commonly available
APY: Savings Accounts vs. No-Penalty CDs

Both savings accounts and no-penalty CDs are usually some of the lowest-yield accounts at banks and credit unions. The interest rates on no-penalty CDs are often a tad higher than with savings accounts, however.

If earning the best rates on your savings while keeping it readily available is your goal, look for an online bank or credit union. The difference between the rates that online and brick-and-mortar financial institutions offer is generally larger than the difference between interest rates on savings accounts and no-penalty CDs within the same bank.

Changing APYs: Savings Accounts vs. No-Penalty CDs

One of the benefits of a traditional, fixed-rate CD is that once it's open, the rate doesn't change (unless you have a bump-up CD or a step-up CD).1 This can be handy if you think rates are high now but will go down soon. It lets you lock in a better rate today than you might get in the future with a savings account.

If you have a savings account, on the other hand, your rate can change at any time.2 If rates go down, you'll earn less interest—but if rates go up, you'll earn more.

Limits on Deposits: Savings Accounts vs. No-Penalty CDs

There are no limits on savings accounts for how often you can make deposits, or how much they have to be. Still, it's good to be aware that some banks have minimum balance limits. These tend to be more common on higher-yield savings accounts. If you're a super-squirreler, it's also good to keep your savings account balance below $250,000, the limit for FDIC insurance.3

When you open a no-penalty CD, on the other hand, it's meant to be a hands-off savings account. Once you open the account, you can't make any additional deposits until the account is closed, either because its term ended or you withdrew the money early. At that point, the only thing you can do is open another CD.4

Limits on Withdrawals: Savings Accounts vs. No-Penalty CDs

No-penalty CDs are much more restrictive when it comes to withdrawals. You can only make one withdrawal, and when you do, you must withdraw the entire CD balance. Normally, CDs charge you an early withdrawal penalty, but with a no-penalty CD, you don't have to pay this fee.5

Savings accounts, on the other hand, are more flexible. You can make up to six withdrawals per month for the most common types of withdrawals, which include things such as ACH transfers, bill payment services, and overdraft protection transfers.6 When you make these withdrawals, you can withdraw any amount you want, from one cent all the way to your entire balance.

Note

The monthly limit of six withdrawals per month from a savings account has been suspended due to COVID. As of publication, it hasn't been reinstated yet.7

Availability: Savings Accounts vs. No-Penalty CDs

Savings accounts, along with checking accounts, are the twin pillars of any person's financial toolkit. You can find checking accounts and savings accounts at just about any bank or credit union.

If you're interested in a no-penalty CD, however, you'll have to look a bit harder. Since they're a bit more unique, they're not offered at every bank or credit union. If you want to keep all your bank accounts with the same institution, look for a bank that offers a no-penalty CD first. Otherwise, you may need to open a separate no-penalty CD account with a different institution than your everyday bank.

Which Is Right for Me?

Savings accounts and no-penalty CDs are great ways to save, and determining which one is best for you depends on your financial goals and intended usage. Here are some questions to ask yourself that can steer you toward one option or the other:

Do I have a lump sum of money I won't need for a bit? Since you can't make regular deposits and withdrawals from a no-penalty CD, a savings account would be a better option if you're still working on saving up.
Do I want to lock in my rate now? If you think rates will be going down soon, a no-penalty CD can allow you to lock in the rate that's currently being offered for a bit longer.
Do I want the most convenient option? You'll need to search a bit more to find a no-penalty CD, and chances are you'll have to open it at a different bank than the one that houses your traditional accounts. If you don't want that hassle, choose a savings account.
Do I want to earn the most interest and still have access to my money? No-penalty CDs usually offer higher interest rates than savings accounts, but this isn't always the case.
Best-of-Both-Worlds Option

You don't necessarily have to choose between a savings account and a no-penalty CD. You can open both types of accounts if you wish.

If you've already built up enough savings to meet the minimum opening requirements for a no-penalty CD, you can open this account and let it sit while you keep making regular deposits to your savings account. When your no-penalty CD matures, you can roll it over into a new one with the savings you've built up in the meantime.

The Bottom Line

You're not alone if you're trying to figure out how to earn the highest rates of return from your savings while still having access to your cash. It might be worth considering other options, such as money market accounts or even CD ladder strategies, which tend to offer higher rates.

Frequently Asked Questions (FAQs)
Which offers higher rates—a no-penalty CD, or a savings account?

Often, no-penalty CDs have slightly higher interest rates than savings accounts, but that's not always true. Sometimes, they're the same. Online banks and credit unions generally offer much higher rates on both savings accounts and no-penalty CDs than brick-and-mortar banks.

What's the difference between a savings account, a CD, and a no-penalty CD?

A savings account lets you deposit and withdraw money without restrictions. With a CD, you can't deposit more money or make withdrawals until its term is over, unless you pay an early withdrawal fee. If you do, you have to withdraw the entire balance, even if you don't need it all. No-penalty CDs waive the early withdrawal penalty, but they often offer slightly lower rates than regular CDs.

Want to read more content like this? Sign up for The Balance’s newsletter for daily insights, analysis, and financial tips, all delivered straight to your inbox every morning!


Was this page helpful?
SOURCES"
benefits of high-yield savings accounts vs traditional savings accounts,No disponible,https://www.thebalancemoney.com/cds-vs-ira-which-should-i-choose-5223353,"PHOTO: 

KATE_SEPT2004 / GETTY IMAGES

Certificates of deposit (CDs) and individual retirement accounts (IRAs) can help you earn money with your money. However, IRAs are long-term investment accounts that offer tax advantages and help you fund your retirement, whereas CDs are usually short-term investments that provide modest returns and mature after five years or less. Learn more about the differences between a CD and an IRA, and when you might choose one over the other.

Key Takeaways
CDs is a kind of savings-style account that typically have terms of five years or less and earn low interest rates.
IRAs are retirement accounts that are more complex than CDs.
You can deposit more into a CD in one year than you can in an IRA.
CDs can work for short-term savings goals, but IRAs tend to be a better fit for a long-term retirement plan.




What’s the Difference Between IRAs and CDs?
 	CD	IRA
Account type	Specialized savings account	Retirement investment account
How it works	You deposit a fixed amount of money for a set term to earn interest.	You hold investments such as bonds, stocks, and exchange-traded funds in the IRA and receive tax advantages.
Terms	One month to five years	Withdrawals before age 59½ often incur a tax penalty
Types	Traditional CD, high-yield CD, market-linked CD, jumbo CD, liquid CD, IRA CD, brokered CD, add-on CD	Traditional IRA, Roth IRA, SEP IRA, payroll deduction IRA, SIMPLE IRA, self-directed IRA
Early withdrawal penalties	Yes, in most cases	Yes, in most cases
Minimum deposits	Depends on institution	Depends on institution
Maximum deposits	Depends on institution	Yes, set by IRS each year
Federal insurance coverage	Yes, up to $250,000 per depositor, per institution	Yes, up to $250,000 per depositor, per institution
Tax benefits	No	Yes
Income limits	No	Yes, for some IRAs
Account Type

A certificate of deposit (CD) is a type of savings account in which you deposit a fixed amount of money for a fixed term to earn interest. An IRA is a retirement account that offers tax advantages and can hold a variety of investments, which can include CDs, stocks, bonds, and more.

How It Works

With a CD, you earn interest by leaving your deposit in the account for a set period, known as a term. When the account matures, or reaches the end of the term, you get your deposit back plus the interest your money earned.

An IRA acts as a basket that holds your investments, which can include CDs, stocks, bonds, and more. However, you can’t hold life insurance or collectibles in an IRA.1 You’ll let your investments grow until you retire, when you’ll begin to make withdrawals from your IRA.

Terms

CDs have terms that usually range from one month to five years or longer.2 With most kinds of CDs, you generally can’t access your money until the end of the term.

Because IRAs are designed as retirement savings accounts, you’ll need to wait until you’re at least age 59½ to withdraw money. You can withdraw funds before that age, but early distributions may be taxed and you may pay a 10% penalty fee.3

Note

You’re typically required to start taking withdrawals from a traditional IRA when you reach age 72.4

Types

Both CDs and IRAs come in a variety of types. The main types of CDs include:

Traditional CD: Traditional CDs have fixed terms and guaranteed interest rates if you keep your deposit in the account until it matures.
High-yield CD: High-yield CDs are like traditional CDs, but offer higher-than-average interest rates.
Market-linked CD: Instead of offering a fixed interest rate, a market-linked CD offers a variable rate based on market measures such as commodities or indexes.
Jumbo CD: Jumbo CDs require a large minimum deposit, such as $100,000.
Liquid CD: Also known as no-penalty CDs, liquid CDs don’t have early withdrawal penalties, so you can access your money before the end of the term without incurring a fee.
Brokered CD: Brokered CDs are sold by financial intermediaries instead of directly by banks or credit unions.
Add-on CD: Add-on CDs allow you to continuously add funds to your CD throughout your term.
Note

You might also come across an IRA CD, which is a CD held in an IRA.

IRAs also come in a range of options:

Traditional IRA: Traditional IRAs offer tax-deductible contributions, and your qualified distributions are taxed at the time of withdrawal.
Roth IRA: With Roth IRAs, your contributions aren’t tax-deductible, but your qualified withdrawals in retirement are tax-free.
SEP IRA: A SEP IRA is a Simplified Employee Pension plan that lets business owners contribute to retirement plans for themselves and their employees.
Payroll deduction IRA: Payroll deduction IRAs enable employees to have their IRA contributions automatically deducted from their paychecks.
SIMPLE IRA: A Savings Incentive Match Plan for Employees (SIMPLE) IRA is a plan that lets employers and employees contribute to traditional IRAs for employees.
Self-directed IRA: Self-directed IRAs let you invest in a broader set of assets than traditional IRAs.
Early Withdrawal Penalties

Penalties for an early withdrawal apply to both CDs and IRAs. With CDs, you’ll often face an early withdrawal penalty if you remove money from the account before the maturity date. For example, a bank may charge you three months of interest if you withdraw money from the CD.

If you withdraw any amount from an IRA before turning 59½ years old, you’ll often be charged a 10% tax penalty and be required to include the distribution in your gross income.5

Minimum Deposits

Both CDs and IRAs can have minimum deposit requirements. However, these will depend on the financial institution you choose.

Maximum Deposits

The bank or credit union issuing your CD will limit how much you are allowed to deposit. For example, a bank might allow you to deposit up to $2 million, not including interest.6

When it comes to IRAs, deposits are limited by the IRS, which sets a maximum contribution limit each year. In tax year 2022, you can’t contribute more than $6,000 if you’re under 50 years old, or more than $7,000 if you’re 50 or older. Those limits are $6,500 and $7,500 in 2023.7

Note

You can’t contribute more than your taxable compensation for the year. Depending on your type of IRA, your filing status and income may also result in a reduced contribution limit.7

Federal Insurance

Both CDs and the accounts held in IRAs can be insured by the Federal Deposit Insurance Corporation (FDIC) or National Credit Union Association (NCUA) up to $250,000 per depositor, per institution. That means deposits owned by the same person at the same bank or credit union are added together and the total is insured up to $250,000. IRAs and savings accounts (such as CDs) count toward separate $250,000 totals.8

You may notice that $250,000 is less than the maximum deposit allowed by some financial institutions. That means any deposits over $250,000 wouldn’t be insured.

Tax Benefits

Traditional CDs don’t come with any special tax benefits. Any interest you earn counts as taxable income in the year you receive it.

IRAs offer tax advantages that vary based on the type of IRA you choose. For example, traditional IRA contributions may be partially or fully tax-deductible, and you’re only taxed when you withdraw money in retirement. Roth IRA contributions are not tax-deductible, but qualified distributions are tax-free.

Income Limits

Issuers of CDS don’t typically have any income limits for depositors.

However, with Roth IRAs, your contribution limit can be affected by your income and filing status. For example, if you’re married filing jointly and made $214,000 or more in tax year 2022, you can’t contribute to a Roth IRA that year.9 While contributions to traditional IRAs aren’t limited by income, tax deductions on contributions can be reduced or disallowed if your income is above a certain amount, and you or your spouse are covered by an employer-sponsored retirement plan.

Which Is Right for You?

If you’re looking for a long-term investment plan that will help you save for retirement, and you don’t have a 401(k) from your employer, an IRA is a good solution. It allows you to gradually save over the years while, generally speaking, earning more interest than you can get from CDs.10


Once you turn 59½, you can begin to take withdrawals without any penalties. You’ll get the most out of an IRA if you start investing early in life, qualify for the full tax deductions on your contributions, and make the maximum allowed contribution each year. However, the contribution limits cap the amount you can invest, so your IRA can only grow so much.3

CDs offer a shorter-term investment option with lower returns but fewer limitations. If you have funds you’d like to keep more liquid but still want to grow, you can turn to CDs with terms from one month to five years. CD laddering is a popular strategy in which investors buy a mix of short- and long-term CDs to improve liquidity while maximizing interest rates.

The Bottom Line

CDs and IRAs can both play important roles in your investment strategy. IRAs are great plans to put into place as part of your long-term retirement savings. Meanwhile, CDs can help you earn interest on a shorter-term basis.


Frequently Asked Questions (FAQs)
Is an IRA or CD better?

It depends on where you're at in life. If you're looking for a long-term investment that you can use when you retire, IRAs are typically the better choice. If you want a short-term, risk-averse investment, then CDs are a good fit.

What is the difference between a CD and an IRA account?

CDs tend to have low APYs and terms that typically range from a few months to five years, although terms can be longer. IRAs are retirement accounts with more complex rules and tax benefits. Generally speaking, IRAs earn more over time than CDs.

Was this page helpful?
SOURCES"
