query,description,link,content
high-yield savings accounts reviews and performance,No disponible,https://www.thebalancemoney.com/weekly-financial-self-care-checklist-5070275,"PHOTO: 

AZMANL / GETTY IMAGES

To get control of your finances in seven days or less, you can start with a simple financial self-care checklist. There are seven things you can do during a week—one per day—to get your money back on track. Here's how your week could look:

Day 1: Take inventory of your finances
Day 2: Get back on budget
Day 3: Pay down debt
Day 4: Build an emergency fund
Day 5: Save for retirement
Day 6: Check your credit score
Day 7: Make your goals a reality

This checklist can help you focus on your financial self-care and manage your well-being. Financial well-being spans four key areas: security to pay your recurring bills, a plan for unexpected costs, freedom of choice with how you spend, and pursuing your long-term financial goals. This checklist covers all four areas. And your success in achieving financial well-being can be influenced by a variety of factors, including your attitude toward money, decision-making, and behavior.

Key Takeaways
You can practice financial self-care by spending a week reviewing your finances and getting your money in order.
Take inventory, get back on budget, pay down debt, save for emergencies, and more.
Managing your financial well-being is important and can help you achieve your goals in life.
Day 1: Take Inventory of Your Finances

The first item on your financial checklist is one you can't skip if you're committed to promoting better financial health. Once you know where you're starting from financially, you can work on fine-tuning your plan for long-term wellness where your money is concerned.

Taking stock of your monetary situation begins with asking the right questions and reviewing the right things. Your budget is a great place to start.

For example, here are some of the most important questions to ask as you take inventory of where your money is coming from and going: 

How much money are you bringing in each month?
Is that income consistent month to month?
How often do you get paid and how are you allocating money toward your bills?
What are your recurring monthly bills? 
Are you overspending in any category?
How much of your budget is going to debt repayment?
Are you including saving as a line item in your budget?

Getting familiar with what you earn versus what you spend is the foundation for any financial self-care plan. But it's also important to look at your bigger financial picture.

For example, if you have debt, you should know who you owe money to, the amount you owe, what you're paying in interest, and what percentage of your income goes toward debt each month. This information can come in handy once you get to Day 3 of your financial checklist (more on that below).

Note

If you have irregular income because you run a business or work as a freelancer, calculate your average income for the previous 12 months. Use that amount as your baseline to compare against your monthly spending.

Day 2: Get Back on Budget

Budgets aren't necessarily set in stone. While your income may stay relatively consistent month to month, you may find yourself spending more or less at different points in time. Charting your spending on a budget spreadsheet can make it easier to spot the patterns in your spending. 

Once you've created your budget spreadsheet, analyze it to determine what you may be wasting money on each month and where you can afford to cut back. For instance, some more-obvious things to reduce or eliminate may include:

Streaming or subscription services you don't use
Recurring memberships you don't actually need (for example, the gym)
Entertainment and recreation
Anything that's not a need, such as electronics, clothing, dinners out, etc.

Beyond those expenses, you should also look for other opportunities to practice financial self-care by trimming your budget. For instance, you may be able to lower your car insurance costs by shopping around for a new provider or save on homeowners insurance by bundling coverage.

Day 3: Pay Down Debt

Debt can be a roadblock on the path to financial wellness. Household debt reached $16.51 trillion in the U.S. in the third quarter of 2022, according to the Federal Reserve Bank of New York.1 Whether it's credit card debt, a mortgage, or a loan, there are ways to pay them down.

If you have debts that you're paying via automatic payments, first review your bank account activity to ensure you have the money to cover those bills. This can help with avoiding costly overdraft fees or late payment penalties if a credit card or loan payment is returned.

Next, consider how to approach your debt payment plans if you have extra money left over in your budget after essential and non-essential expenses are covered. If you're carrying high-interest debt, that money could be applied toward those balances to pay them off faster. The sooner you can clear high-interest debt, the more money you can save on interest charges. There are a few strategies you can try, like the debt snowball strategy or the debt avalanche method.

Keep in mind, however, that you may want to allocate extra funds to savings if you don't have anything set aside for emergencies. According to a 2018 study from the Federal Reserve, approximately 40% of households aren't able to cover a $400 emergency with savings.2 If you don't have any money set aside, building up your savings can keep you from having to add to your debt by using credit cards to cover unexpected expenses.

Tip

Consider consolidating your debt or even refinancing your student loans to secure a lower interest rate. You may also be able to transfer high-interest credit card balances to a card with an introductory 0% annual percentage rate (APR).

Day 4: Build an Emergency Fund

Emergency funds can help bail you out financially if you run up against an unplanned expense or a financial situation you weren't expecting. They take time to build, so starting as soon as you can with any amount will help.

For example, if you get laid off from work or get sick and can't work, an emergency fund can help cover bills until things get back to normal. You can also draw on emergency savings to pay for things like vet bills, car repairs, or another critical expense you didn't see coming.

The amount you should have saved is up to you, although financial experts often recommend having three to six months' worth of expenses saved.3 Another rule of thumb you might use is to save a set dollar amount for each member of your household. So if you're a family of four, you might aim to save $2,500 per person for a total of $10,000 in emergency savings.

An effective way to save for emergencies is to add it to your budget as a recurring expense. By treating savings like a bill that has to be paid, you can ensure your emergency stash grows consistently.

Important

Emergency funds are meant to be liquid savings, meaning you can tap into them when you need them. For that reason, you may want to use a high-yield savings account or money market account to hold your money, in place of a certificate of deposit (CD) or investment account that has stricter rules for withdrawals.

Day 5: Save for Retirement

While you may not track your retirement savings every week, it's still important to have this item on your financial self-care checklist. Knowing how much you're saving (or not saving) toward retirement can help you determine how likely you are to reach your goal.

Investing through a 401(k) or 403(b) is often the easiest place to start with retirement planning. Many employers make it easy to save by making enrollment automatic when you're hired. If you're not sure whether you're enrolled in a retirement plan at work, get in touch with your human resources department. They can tell if you're signed up, what you're investing in, and how much you're contributing each payday.

If you don't have a retirement plan at work, an individual retirement account (IRA) is another way to save for the future. IRAs offer a tax-advantaged way to save for the future, and you can open one at virtually any online brokerage.

As you check in with your retirement savings plan weekly, monthly, or quarterly, pay attention to the things like:

How much you're contributing each month and year
What you're investing your money in
How well your investments are performing
What you're paying in fees to invest

That last part is important because fees can eat away at your returns over time. Investments like low-cost exchange-traded funds (ETFs) can help keep fees at bay.

Tip

Use an online retirement planning calculator to estimate how much you'll need to save monthly or yearly in order to set yourself up for your future.

Day 6: Check Your Credit Score and Report

Checking your credit score yourself doesn't impact your credit report or score, so it's fine to add this to your weekly financial wellness routine. As you look at your credit score, take note of how it's gone up or down over time. Then refer to your credit report—you can get a free report every year (if not more frequently) from AnnualCreditReport.com— and pay attention to what's on there to see how it may have impacted your score.

For example, things such as paying bills on time, keeping credit card balances low, keeping old accounts open, and only applying for new credit sparingly can have positive impacts on your credit. Paying late, running up large balances in relation to your credit limits, and opening multiple credit accounts in a short period of time can hurt your score.

Also, review your credit card statements each month to check your total spending and what you may pay in interest charges if you're carrying a balance. This is also a good opportunity to review your statements for suspicious transactions that could indicate fraud.

Note

If you find a credit report error, you can dispute it with the credit bureau that's reporting the information. By law, information that's proven to be inaccurate must be corrected or removed from your credit report.

Day 7: Make Your Financial Goals a Reality

Setting financial goals is another important aspect of self-care when it comes to your money. A lot of what's included on your financial checklist affects your money situation right now, but you should also keep the future in sight.

Ask yourself what your financial goals are. They may be something simple, like taking a solo vacation or buying a new car, or something bigger, like buying a home. As you brainstorm goals, create a roadmap for achieving them.

For example, say your goal is to pay off your $20,000 in student loans in the next two years. Your current monthly payment is $500 and your interest rate is 7%.

In this case, your financial checklist may look something like this:

Refinance private student loans to lower your interest rate
Increase your monthly payment to $875
Review your budget to find the extra $375 to apply to your loans
Consider starting a side hustle to bring in the additional money you need if you can't find it in your budget
Apply any financial windfalls, such as a tax refund or stimulus check, to your principal balance

You could use the same approach to save $20,000 instead if that's your goal. Only the steps might be something like:

Open a high-yield savings account to earn the best annual percentage yield (APY)
Review your budget to find $875 to save each month
Start a side hustle or use cashback apps to increase the amount of money you can save
Grow your savings faster by depositing tax refunds or other windfalls into your account

The key is making your goals specific, measurable, achievable, relevant, and time-bound. And besides that, make sure you're keeping track of your progress weekly, monthly, and annually to see where you may need to adjust your plans.

Frequently Asked Questions (FAQs)
What is financial wellness?

Financial wellness is the way you feel about your finances and how that money helps to fuel your security and freedom in life.4 If you feel good, your wellness and well-being is high. If you feel like your finances are out of control, you may need to get back to financial health by following a few steps.

How can you take control of your finances?

You can take control of your finances by taking inventory of your money, debt, and bills. Then, you can make a budget and pay down debt. Save for emergencies and retirement to set yourself up for future success. And make your financial goals a priority.

Was this page helpful?
SOURCES"
high-yield savings accounts reviews and performance,No disponible,https://www.thebalancemoney.com/what-is-a-credit-union-5216864,"PHOTO: 

ÂSIMONKR / GETTY IMAGES

DEFINITION
Credit unions are financial institutions owned by their members and operated as nonprofits.

Credit unions are financial institutions owned by their members and operated as nonprofits. Initially created to serve and support people who share a common bond (such as place of employment or residence), many credit unions offer many ways to join and enjoy membership benefits. 

Let’s explore what credit unions are, the services they provide, and how credit unions work, as well as the types of credit unions, membership requirements, and how they compare to other financial institutions such as community banks. 

Definition and Example of Credit Unions

A credit union is a not-for-profit financial institution co-owned by its members. A credit union's members elect a volunteer board of directors to help manage the credit union. Profits are “returned” to credit union members in advantageous financial products and terms, while shareholders benefit from bank profits.1 Some credit unions return profits as annual dividends.

A member banking with a credit union might benefit from lower-than-average interest rates on loans or credit cards or higher-than-average interest rates on any money they save with the credit union.1

Many credit unions were originally established by and for a specific group of individuals. For example, the Navy Federal Credit Union was originally for Navy service members. Today, the credit union welcomes all current and retired armed forces (including the National Guard and Space Force), their household and family members, Department of Defense civilian employees, contractors, and reservists, among others.2

The National Credit Union Association (NCUA), created in 1970, regulates credit unions. The U.S. government backs federally insured credit union member accounts of up to $250,000 per account, similar to how the Federal Deposit Insurance Corporation (FDIC) backs bank deposits of up to $250,000.3

How Credit Unions Work 

Any profits the credit union receives as a result of lending, borrowing, or acting as a depository are returned to the members, typically in the form of lower interest rates on credit cards, home loans, personal loans, and car loans. This is paired with higher interest rates on CDs, money market accounts, and potentially, other savings accounts.

Note

Credit unions aren’t immune to financial winds. Credit unions often offered slightly higher interest rates for regular savings accounts in the past. As of late 2021, however, credit union national average rates for savings accounts are on par with banks’ national average rates due to the low-interest-rate environment overall.4

To become a member of a credit union, an individual opens a “share account” (like a savings account) with a small dollar amount. This represents your “share” or investment in the cooperative financial institution and is refundable if you close your account.5

Typically, you can open a credit union account and conduct your banking as you would at any other financial institution. These accounts may have different names: 

Bank	Credit Union
Customer or account holder	Member
Savings account	Share account
Checking and savings account	Share draft account
Certificate of deposit	Share term certificate or share certificate
Accessing Accounts

Many credit unions offer limited brick-and-mortar locations for banking services, and limited ATMs for withdrawing money, often located in specific geographic areas. One of the largest credit unions, Navy Federal Credit Union, offers 350 branches.6 One of the largest U.S. banks, JP Morgan & Chase, offers 4,700 branches.7

To offer members access, just under 1900 credit unions are part of the CO-OP Shared Branch network. If a credit union member needs to deposit a check while traveling, they can visit a partner credit union’s location or use its ATMs without paying a fee. The CO-OP Shared ATM network offers more than 30,000 surcharge-free ATMs throughout the U.S. and 10 nations.8

There may be some limitations, though—for example, you might be limited to $500 per day in withdrawals at the shared branch, funds may not be immediately available, or there may be fees associated with various services.9

Note

Some credit unions may refund or rebate fees incurred from using out-of-network ATMs for cash withdrawals for certain account types. 

Credit Union Services

Credit unions offer many of the same services as those found in banks, including: 

Accounts for savings, checking, and certificates of deposit
High-yield savings accounts
Online, ATM, and mobile banking
Mobile, online, and person-to-person payments 
Credit cards
Investment services including IRAs, other retirement accounts, and living trusts
Consumer loans for cars, boats, RVs
Student loans
Small business loans
Mortgages, home equity loans, and home equity lines of credit (HELOC)
Wire transfers, cashier’s checks, and ACH deposits
Safety deposit boxes
Personal insurance services

Services and products vary by credit union, and many come with provisions; a high-yield account, for example, could require a certain credit card spend or balance. You’ll need to carefully review the options to ensure the credit union offers what you hope to find. 

Credit unions may present limited choices, as well. For example, a credit union might offer only a handful of consumer credit cards versus the dozens offered by a bigger bank. The new-cardholder bonus or cash-back rate may be lower than bonuses at larger banks—but the interest rate may be lower as well. 

Note

You may not be able to perform some international services with a credit union account. For example, the credit union may not support wired transactions in a foreign currency, while banks may be better able to. Some banks may also provide cash in foreign currency or exchange foreign cash you return with from your travels—both more uncommon at a credit union. 

Who Can Join a Credit Union?

While anyone can join a bank, a credit union may require you to be part of a particular constituency to become a member and open an account. Typically, you need to have something in common with the other members. 

Gerenally, you can join based on one or more of the following categories: 

Employment: If you work for a specific employer or you’re employed within a particular profession or trade
Family: If you’re related to an existing credit union member 
Location: If you work, attend school, or live in a certain geographic area  
Membership: If you’re a member of a school, union, organization, or other group 

Many credit unions offer more than one path to membership, but you’ll often have to look beyond the name—which usually indicates for whom the credit union was originally intended, but has since expanded the field of membership. As an example, eight Delta Airlines employees founded the Delta Employees Credit Union in Georgia in 1940.10 Today, to join the Delta Community Credit Union, potential members can qualify by their geographic location, employment by dozens of local and national businesses, family relation to a current Delta Community CU member, or as part of membership in a variety of associations.11

Note

You may be able to join a credit union by first joining an organization. For example, becoming a member of Foster Care to Success makes you eligible for Alliant Credit Union membership, even if you don’t qualify in any other manner.12

How Much Do Credit Unions Cost?

Initial membership or sign-on fees for most credit unions are minimal. The credit union may ask you to make a refundable contribution of a few dollars toward your share account to get your membership started. Other credit unions may require initial deposits of $25 or more, or a small donation to an organization. To join the Lake Michigan Credit Union, for instance, a $5 donation to the Amyotrophic Lateral Sclerosis Foundation is required if you don’t meet any of their geographic or employment requirements.13

Fees at credit unions are often much lower than other banking institutions. For example, many credit unions offer free basic checking accounts that don’t require a minimum balance and don’t charge monthly maintenance fees.

However, fees can be and are often still charged for other products or services, including stop payments, nonsufficient funds, card replacement, or wire transfers. Some credit unions charge monthly fees for certain checking accounts, although they may come with additional services. 

Note

Credit unions may charge inactivity, dormant, or “non-participation fees” if you don’t appear to be using your accounts, usually after some time, such as 12 or 24 months. 

Types of Credit Unions

There are a few credit union types that serve special populations: 

Low-Income Credit Unions: Serves a population in which more than 50% of its members qualify as “low-income,” earning 80% or less than the median family income or individual income for designated locations. The population’s unique needs may include access to small-dollar loans and business loans, money orders, check cashing, and financial education. 14
Minority Depository Institutions (MDIs): To qualify as an MDI, more than 50% of current members, current and eligible members (from the community), or current board members must be from these federally recognized minority groups: Black American, Asian American, Hispanic American, or Native American. 15
In-School Credit Union Branches: Also known as student-run credit unions, these credit union branches allow students to open savings accounts and deposit money into their accounts. Branch services vary by the school and credit union and often rely on student or parent volunteers trained to carry out tasks. 
Credit Unions vs. Banks

Here’s a quick look at credit unions versus traditional banks. 

 	Credit Unions	Large Banks
Tax Status	Not-for-profit	For-profit
Use	Members united by a common bond	Anyone
Physical Branches	Possibly limited unless credit union is in CO-OP network	Range between 1 to thousands
ATMs	Local only unless in an ATMs network	Often nationally available
Account name	Share account	Savings account
Services and products	Vary by credit union	Usually consistent, although some products or rates may vary by consumer or bank location
Savings, money market, CD interest rates	Generally higher	Generally lower
Loan and credit card interest rates	Generally lower	Generally higher
Fees	Generally fewer	Generally more
Fund Insurance	Up to $250,000 by NCUA (National Credit Union Administration)	Up to $250,000 by FDIC (Federal Deposit Insurance Corp)
Profits	Returned to members through dividends, advantageous rates or fewer/lower fees	Distributed to shareholders
Foreign cash access and wires	May not be as readily available	Readily available, particularly at larger or international banks
Alternatives to Credit Unions: Community Banks or Online Banks

If you don’t qualify for credit union membership or there isn’t one in your town, a community bank is a possible alternative. A community bank is usually privately and locally owned. According to the U.S.Federal Reserve, community banks typically hold less than $10 billion in assets.16

Community banks often also offer:17 

Lower fees 
Better interest rates for loans, credit cards, and savings accounts
Local control and decision making 
Lending for local small businesses
Community relationships, involvement, and specialization 

Online banks or online-only accounts can be another alternative not charging checking account maintenance fees, although they may have minimum balance requirements to earn higher interest rates, and may not have physical branches.

Key Takeaways
Credit unions return profits to members through better interest rates, lower fees, and dividends.
Credit unions are regulated by the NCUA, which guarantees deposits of up to $250,000.
Services and products at credit unions vary widely.
Compare the service options and products you’re likely to use at a credit union on an apples-to-apples basis to banks, online banks, and community banks. 
Was this page helpful?
SOURCES"
